,comment
1870633, 没什么可看的，在特效片中也不算什么特别的
1685197, 哈哈哈管他呢看见有人5星我就得补个一星！
946304, 那么烂的剧情+演技+黄子韬，就是0分啊！
1685259, 一个下午看完三部 前所未有的头昏脑涨……
946454, 如此统一的短评和影评页面，还是第一次见🌚
946430, 不管改编自何这样不尊重原创作都太恶劣了。
1684381, 哈哈哈哈哈哈哈 居然有人能拍出这样的电影
837107, 真的很无聊…… 没有节奏感……全程打瞌睡
1690417, 完全不是电影的手法，直接拍成电视剧算了。
190221, 毫无新意，充满了好莱坞和美式的噱头，烂片
946488, 天蝎男都该来看看他们天蝎男是怎么作死的。
1684233, 顾准和neil没在一起我这票钱不就白掏了
1805096, 是不是需要中国人民派一个张杰去关门？！！
1690306, 说是粉丝电影的ppt，真的就是个渣。。。
1684492, 花絮比正片好看。。我去看眼柯震东而已。。
1684482, 没去看。同学六年老粉怒转黑，可见太差了。
946306, 真心差，情节不连贯，光打的实在太别扭了。
945715, 看的时候觉得应该是烂片，看完果然没有失望
1689945, 至于一定要拖到第四部么。。。太无语了==
1686020, 里面好像只有席城和卫海的普通话比较标准。
1686165, 彩蛋后面竟然是下集预告 干脆拍电视剧得了
945756, 要不是有黄晓明，我还真以为看的是小时代。
1686116, 这种东西还有第三部？？？？？？？？？？？
944171, 黄晓明 杨幂 是烂片的保证，是烂片的福音
945542, 真的好难看啊，为什么顾漫的烂文老是拍啊拍
1802519, 勉强把人性写得那么恶劣 骗高分 浪费时间
1869421, 情节太丑了。最后还有种要拍5的埋笔，要疯
1686366, 第一次因为没去电影院有种省下巨资的感觉 
1689875, 撕逼 PPT 撕逼 PPT 无限循环……
1685485, 牙都酸倒了 撕逼大战！ 求给负分！！！！
1690093, 对 我就是来拉低评分率哒！烂片中的战斗机
292853, 远观就是来悔原著的，如果质量好再来改评价
944051, 一星给佟大为老师和杨幂的美少女战士扮相。
1869364, 华人面孔里面英文说的好的就只有王敏德了！
946011, 原来可以有这么烂的电影，居然也能叫电影。
946066, 好好的一部剧...搞成这样...唉...
944047, 竟然……又来了一遍，真下饭晓明哥哭的真丑
1685670, 看完小时代 青春期都被原谅了 能给负星吗
945861, 一直闪片是什么回事？真以为在放ppt啊？
1870435, 不知所云，一直在看表到底什么时候才打完啊
1685831, 越来越离谱了！甚至没有一秒钟经得起推敲！
1690015, 好一出年度撕逼大戏，好吧还是一部烂片。。
1685787, 下周必须看“后会无期”来弥补下内心的创伤
1685784, 一星都觉得给多了，《梦里》还在卖是不是？
1685774, 祝福你我，愿在下一个小时代，依旧笑靥如初
1870498, 这片要是得二星或者4分以上，是豆瓣的耻辱
951526, 我错了，我不该怂恿朋友来看，我真的错了！
951481, 如果要看教主大胸的话我何必要花30块钱？
1693599, 都是噱头，开头结尾都很突然，除了人美了点
1673109, 真的很豪华，真的很养眼~就是广告片长了点
1672780, 拍到第三部还没学会怎么讲故事也是蛮拼的。
951359, 陪妹妹看的，看完我只想说''我了个去''
823088, 对不起，真是喜欢不起来这个调调的电影……
204194, 超级烂！！！！！！！！！！！！！！！！！
951318, 就是一群帅哥美女拍的广告大片，一分给颜值
1730224, 沙琪玛，沙琪玛。。。。女孩声嘶力竭地喊着
1693568, 都到4分啦，不科学啊！一星送给郭比特人！
327255, 对不起，我还是不适合国产动画……我尽力了
1673249, 真心没脸说我看过，还是花了15块钱看的…
1710131, 生活中的穷屌丝演了一群高富帅白富美。。。
1672357, 每次《小时代》上映都来看豆瓣评论最开心了
951857, 还能再烂一点吗？？！居然比左耳还烂...
1693837, 对80后来说，帅哥靓女已经不是主要的了。
951872, 分不清是编剧不会改故事还是导演不会讲故事
1672123, 大家好，我们是时代撕逼姐妹花。凸^-^凸
250957, 让看过原版小说的人有一种无法言语的挫败感
1672619, 小学生放假了好可怕，没事干就撕b打架玩。
1709977, 一星支持下 四娘加油 永远支持你 么么哒
951651, 要是没看过书或是电视剧版的根本看不明白吧
1672670, 看到 各個生硬的演員表情和妝髪 就想點×
285568, 赵又廷，害了这部电影。高圆圆不知道怎么了
1673402, 看完后有种死里逃生的感觉，我是指恶心死。
1674222, mlgb撕逼撕的这么做作也真的是受不了了
250296, 观影建议：请先观看《盗墓笔记》后再观影。
1693391, 小四你能秀点智商吗？还怕谍战~你骗谁呢！
927191, 中国的喜剧片，只能这么无脑无营养吗。。。
1674056, 撕逼撕的不够扯啊不开心，还没2好呢呵呵呵
1710442, 我要让全世界知道，1星已经被小时代承包了
1674045, 要是没有谢伊霖，这部电影真是一无是处啊。
1710425, 刷新了我对烂片的理解。。。烂到震撼。。。
951039, 一星都不想给，服装道具场景演技都让人捉急
951000, 那段把他们都关进牢里面去还是挺还原原著的
950940, 为什么我要点这个脑残剧( ｰ̀дｰ́ )
1674306, neil那个演员很加分= =虽然只有一颗
950830, 别闹了！请把我们的唐嫣和钟汉良还给我们！
250263, 完全没看明白 看到最后两分钟才知道讲了啥
1674401, 故事告诉我们，不需要有故事，有钱就够了。
229934, 还能更烂吗？不能了，还他妈3D，滚JB蛋
250334, 雪莉是全剧最大的人物败笔，因而此剧是败笔
951222, 久别重逢与破镜重圆，大概只有电影里会有。
1729933, 这绝壁是散户在电影史上被黑得最厉害的一次
1863278, 各种广告，还有拖沓的剧情，还我变形金刚。
250454, 面目全非，前言不搭后语，陆导您到底怎么了
186759, 近距离打斗从头到尾土里滚，主角全部去魅…
1673447, 无论评分多烂都不妨碍二逼去送钱。好样的！
1836250, 除了爆炸和满天的碎片还有什么？无脑大片。
951108, 毫无逻辑性，乱七八糟，烂到无以复加。。。
1710401, 一星有点高，0.3星其实是比较贴切的评分
823325, 一段错误的过去有什么可回忆的，无聊爱情片
1673963, 我果然老了，完全理解不了片中人物的思维。
250346, 一分给特效，给特效加工资吧，其它全是粑粑
1810886, 就冲这部片子被吹捧的这么厉害，我给零分。
1710290, 🐎只要郭导不再拍续集 我就不和你们争小野
951183, …男女主整容脸零演技，函数为什么要用原声
1673768, 如果可以打负分的话，我一定给负五星！！！
951144, 要不是陪女人，我才不会看这恶心的“电影”
212212, 以为结束了还有 还有 还有。。。。呵呵呵
1674661, 莫名其妙的剧情，无话可说的演技！蛇精病。
952608, 观赏此类影片只是为了感受国产电影烂的程度
952612, 一颗星给配乐。全场都把这片看成了喜剧片。
1670248, 不行 看着豆瓣里一群脑残 我实在忍不住了
251542, 为什么没有零星呢？垃圾电影，谁看谁后悔！
251535, 妈的气死我了！烂片！从此开始讨厌陆川！！
203875, 尽己之力规劝大家不要看。不要看啊不要看。
952671, 婚前杜绝性行为 你一定可以找一个神经病！
1670090, 对于任何没有深度的片子都可以称之为烂片！
952691, 一块钱去看的，觉得亏爆了，一块钱都不值。
329168, 你吹你的大圣我没意见 不要扯上Pixar
251418, 零分在哪里？？？全程烂到不可思议啊卧槽！
1670495, 一看就知道是BB的东西还会傻到去吃吗 ？
1670508," 一天时间分数上升了这么多，630,5.0"
1670331, 不多说， 几天后会发现我这个决定多么明智
1670391, 预告片比正片好看多了，年度烂片又多了一个
1669652, 看到郭敬明我就恨不得把杨幂的脚塞他嘴里。
1669706, 先黑了再说，看它就是为了刷新自己的底线~
1669702, 小说的犀利用词都表现不出来…只能说 失望
1669699, 麻痹郭敬明的电影就跟他的身高在同一高度！
952854, 太丢脸了。。。。 演员和导演都怎么好意思
1669584, 完全不知所云，如果票房高，就是民族的悲哀
1709172, 剧情逻辑完全不通  有可能太高深 看不懂
1709191, 华而不实，不知道导演到底想阐述上面东西！
952930, 差死了，看过电视剧的来看，这踏马什么玩意
1669492, 你们难道是要让这部电影的评分超过超人吗？
1669508, 小明啥时候长到跟我一样高我啥时候来改分。
1669753, 不用看就知道是烂片，不用吃就知道是大便。
309292, 论安利的正确方法，刷的太猛了平衡下分数。
1669922, 矮子男+水桶脸=烂片=小时代。。。。。。
1669941, 不值票价，请别侮辱青春，顺便恭喜票房爆红
952706, 中国电影怎么烂成这样🙄️ 瞥见这电影有感
1669967, 让人无力吐槽，这部电影是高中生们的青春吧
1694434, 可以给半颗星吗，就为了好歹你们拍了个片儿
1669863, 毫无看点，要不是郭采洁(^_^)绝不会看
228805, 发霉的方向，无逻辑的故事，无厘头的逻辑；
1669849, 看这么火的节奏，估计会出小时代2.0……
1709327, 世纪大烂片。我想说的是，为什么没有0星。
1669834, 大型mv   富二代90后的生活   假
952693, 一定是梅雨季脑子发霉了才会把这看完。。。
309639, 国漫一生黑  再也不要上这种情怀的当了🙄
251121, （台山商业城大地影院）怪兽特技还是不错的
1671466, 无节操 无下限 唯一安慰的是hold住姐
251085, 难看到哭了 55555555555555
186568, 确实有笑点，不过还是一部爆米花电影。。。
951979, 意料之中的烂，主演两位可以是烂片代名词了
1671864, 表弟是我的菜啊我的菜，另外撕逼给我看哭了
1671851, 第一部还能看到点用功，往后就真的是在扯了
890861, 不是黑水，但是8.7太夸张了，平衡一下…
1671973, 看了两小时的广告MV撕逼大战我也是醉了。
951999, 艾玛烂片，节奏太快，气质不对，毁了小说。
1671588, 这种片子电影院上映会教坏小朋友三观的！！
1671710, 希望小朋友们记住120这个急救中心的号码
1670592, 全是商业炒作，现在的电影，需要的是实力~
251316, 去看原著！去看原著！还是去看原著吧！！！
1670807, 因为杨幂，感觉整个片子都散发出浓重的脚臭
1709637, 大型MV，没有剪辑，没有逻辑，没有演技。
952443, 一群小伙伴在欢乐的吐槽中结束了整部电影。
1709581, 抱着养眼的态度去的，也只起了个养眼的作用
1855715, 史上最差变形金刚。适合年龄为12岁以下。
952348, 佟大为啊你是疯了才会让这片子这样践踏！！
285104, 扯淡的剧情扯淡的演技电影院的爆米花还不错
251255, 毫无逻辑，扯得没边，感情突兀，演技太渣~
1709661, 本来是去打发无聊时间的，结果差点看吐了。
251250, 看了半个小时，实在找不到理由继续看下去了
1671023, 如何拯救我们的后辈不被错误的价值观所误导
1671022, 如果可以打负分。。。。为导演而打。。。。
193360, 难看，剧情简直无脑到一定境界，太无聊了！
949308, 坚持看了45分钟！！！最后受不了了 关了
949309, 你爸自杀了 你拿着这些钱在美国好好生活吧
1692307, 100分钟过去了，还是没看懂，智商捉急！
1711358, 本来还想看的，但是看了影评，瞬间没了屎欲
1711349, = =虽然我是四娘粉 但我还是想黑四娘！
1678142, 被吓到了 影院不少学生妹纸哭得伤伤心心的
949253, 我也不知道是什么支撑我看完了这部烂片。。
1677966, 一二三部成为中国圈钱烂片电影史的新里程碑
1677991, 郭敬明脑洞还能更大点么？居然还他妈有4啊
248827, 以后看到陆川必须绕路走！再也不给他机会了
1678013, #做一次九零后#对这种jb片没什么好说的
1678410, 完全不知所云，我为自己的理解能力感到悲哀
1678392, 唯一的印象就是南湘穿红裙子站在烟花里好美
1711437, 因为杨幂脚太臭，所以全程都是捏着鼻子看的
248657, 还是那句话，就是不信陆川这辈子能硬一回！
1678436, 到底有什么好看——我是看了才这么评价的。
1678254, 先婊一个星点个赞，上映时一定不去看么么哒
1692202, 谁特 两个半小时居然还尼玛没完还有四谁特
1678293, 前一晚撕逼撕成那样，第二天就和好了。。。
1692211, 这么垃圾还这么卖座，可想而知内地多少弱智
1711393, 你问我电影好不好看，我告诉电影院好好吃！
1711388, 什么烂电影，白瞎了30块的电影票 ！！！
249020, 作为一个不看结局会哭的人对此片表示愤怒。
1677428, 我真的有些没看懂，好吧，我承认，我脑残。
1711201, 只是想由衷地赞美一下，这都是什么JB玩意
1692441, 简直了 对于片中的爱恨情愁没有一点感触 
244028, 尼玛不带这么玩滴，有这么明目张胆抢钱的么
949594, 电影负五星，幂幂的腿六星，加起来刚好一星
1711193, 演员演技差，剧情无聊，结局草率，烂片一枚
1692458, 前两部我还给了3颗星，这部直接flop掉
1808853, 没觉得哪里好啊，为什么怎么多人觉得好呢。
1711313, 我真的觉得郭精明不要再拍了，电影界不缺你
1677725, 还有比小时代3更烂的片吗？有，小时代4。
1678473, 郭敬明的导演原则就是 视觉上好看怎么都行
289419, 逻辑不通    剧情难看   一星给特效
1711651, 我觉得一整部就是故弄玄虚，没什么值得赞的
1679238, fendi赞助了此次撕逼俱乐部的娱乐mv
1711648, 打五星的有多少脑残粉，站出来给大爷吼一声
1679366, 不明白为什么一群人要穿着皮草和高跟鞋跑步
289445, 如果拍烂片会被判刑的话这个片够判个无期了
1862781, 到现在只记得舒化奶广告和老公的邀约短信了
1679381, 猥琐地窥探了一下城乡结合部少女的精神世界
1868879, 别再拍了    跟1和2没法比都    
1691856, 他的前两部是个故事，这只是个拼凑的MV.
1679621, 坐在我旁边的姑娘看到一半居然戴起了墨镜。
1711720, 没什么，除了场景，剧情和寓意都不值一提！
1679575, 1星，众望所归，狗屁的剧情，应该给负分。
205060, 这片客观地说，应该给2星，可惜我没法客观
943275, 真不知道为什么出现那么高的票房，烂片！！
1679390, 真的觉得三部里最难看！虽然颜值最高= =
872397, 这种低俗影片竟然这么好票房，真他妈的垃圾
289460, 很烂，然而还有一大票的人看，到底怎么回事
1801464, 没有一点新意，难道是因为看的美剧太多了？
1711675, 花了2个小时看了这部脑残片，最后我又吐了
1679484, 这个电影的逼调太高了。全程抬头看，脖子疼
248594, 姚晨为什么接这种片子，是帝都房价太高了吗
949037, hhhhhh看了十分钟笑得脑髓都要出来了
1678655, 其实我就是不打一星都不好意思说混豆瓣的人
1841514, 故事没了，猛男来了，爆炸还在，又怎样呢？
1692128, 原来中国是有美男的，为中国美男加一星⭐！
949047, 杨幂一说话我就生理不适，听听歌还是不错的
949031, 一分都懒得打，我妈国产片小天使都震惊了。
1678703, 狗血+撕逼大战。这女的感情比男的还爷们儿
1692140, 我还没有看这个电影，我只是单纯的想给差评
1692134, 前两部我还给两星，这一部真的只能给一星了
248499, 赵又延这种万年面瘫能不能混混演技再出来？
948956, 没看过电视剧和小说的肯定觉得这片日了狗。
948973, 还能更烂点么？？？简直是烂片中的战斗机！
1711576, 我知道就算这电影分数再低也一定有人花钱看
295680, 剧情什么鬼，我不想吐槽，水军一大把的感觉
289267, 极差，还有比一星更低的分吗，有的话告诉我
948938, 太屎了 BABY的颜都无法支撑着我看下去
323901, 情感绑架 好的画面技术掩盖不了故事音乐屎
249091," 我就给一星片尾的BGM,,,demons"
950377, 商业片泛滥的年代。中国电影最黑暗的时期。
950357, 我想说教主就是个drama queen！
1675399, 我不会看这个电影的  所以我是来打一星的
1692988, 我就是看了一年级突然想多看看那张帅气的脸
1693030, 论女演员自我修养——穿着恨天高跑步不带喘
1693009, 第一次进影院，我花了80去看了部大型mv
1710761, 一部脑残动画片的真人版搬上了大银幕而已。
1728527, 满屏bug和套路 真是没法接受这个分数。
1676022, 简直看不下去，真的有人去电影院看啊！！！
287698, 一群人依靠不菲的特效在拍没头没脑的动画片
1675959, 特讨厌几个女演员给人的感觉，男演员也是。
1675742, 吐槽电影的作用就是在电影院吐吐槽发泄压力
950320, 哈哈，果然还是有杨幂老残粉说这片子不错的
1675821, 把一团卫生纸炒的再好吃也比不上水煮的白菜
1675797, 无节操无底线的炫耀小四的幼稚及无限意淫！
249687, 哈哈哈看完盗墓笔记现在才发现你的好！！！
1710663, 我很奇怪竟然没上IMDB的最烂电影排行榜
1873452, 一星给特效。导演，叙事麻烦讲点逻辑好么！
950607, 真的超后悔花了一个小时看 虽然还是快进的
1839012, 钢铁之躯评分和这货一样，果然国人的审美啊
212088, 中国人这点苦逼的被QJ了无数次的爱国之心
1710630, 我知道我很武断，可是我就是不喜欢这些烂人
249918, 我为什么要去电影院为这种傻逼电影贡献票房
1675278, 一星给我大幂幂神演技！其它都是配角浮云。
950491, 感谢电影，我从电视剧黑转变成了电视剧粉。
1780875, 原本可以打三分的，但不得不平衡一下分数。
1710707, 分数越来越高这不行啊 这明明是负分的水准
1693154, 一星送给郭碧婷，没有看彩蛋就逃出来了。。
950555, 哈哈哈哈哈哈太傻逼了。每个人都太尴尬了！
1675141, 出了3不是最傻逼的，最傻逼的是还要出4！
1676724, 送上一颗星，感觉自己萌萌哒╮(╯▽╰)╭
1711070, 我们这小县城很多技校的少女在排队买票呢。
1676716, 从来没有看过乳此残忍的片子. 简直要折寿
1711069, 真的很不错啊，我一定要再看一遍老鼠爱大米
1676691, 两大女神在里面，但是豆瓣为什么没有负分。
288329, 姚晨死了，姚晨活了，姚晨又死了，全片完。
1677186, ...啥也不说 一颗星是给喜欢的演员的颜
1677133, 有完没完，小四老了自己看这片儿不会羞死吗
1711136, 顿时就哭了，哭的不是剧情，而是我的钱啊。
249171, 拍的倒是可以，但跟原著一点关系都没有！！
872996, 不懂分高的原因诶-________-''
1711028, 片尾曲是啥有洗耳水的话麻烦给我一打谢谢！
7672, 一个阅读障碍的我确实不喜爱太复杂的科幻片
249518, 傻逼的不能再傻逼了，寻龙诀真是满分之作！
1833586, 2个半小时看了部广告巨片，1星给IMAX
287797, 完全是浪费钱，国产电影讲故事的能力是真差
287751, 拍出可可西里的导演 怎么能回出这种东西的
1676126, 我以为12已经很没谱了。没想到3那么没谱
1676123, 喜闻乐见，一上来上师大球场就被黑了...
1781399, 不知道，看着很烦躁，所以一星，真的看着烦
1676113, 哈哈  我这才反应过来我没给时代3打一星
1692698, 虚荣精致利益主义者的奢华装逼生活 第三季
287997, 稀烂的剧情，完全就是看看特效，太不推荐了
1676321, 真的看了霍比特人拍的这部电影，特来打分。
1676319, 为什么！为什么没有0分的选项啊！！！！！
249487, 什么鬼扯的 我的白眼都已经用完了啊啊啊啊
1710965, 任何语言文字都不足以表达这种电影的恶心了
1809578, 6-7左右的片子，跟风狗太多，那我给1星
1868634, 越拍越差劲，十分失望，希望变5能重新给力
950012, 新年里大家还要一起愉快地吐槽(゜∀゜)/
1692705, 我。。。我居然被逼的看了小时代。。！！！
1710984, 能勉强给的一分都是因为吴亦凡唱得深入我心
208512, 我是宝宝的脑残粉我要给其他电影都打1星！
270260, 靠 这破电影还能得4.3分 这没天理啊 
1645324, 小时代，请问您是在炒身高吗，还是炒臆想。
1796506, 逃的过丧尸却逃不过人心！小女孩演的很棒！
1646013, N久以前看的了，还深刻地记得：毁三观！！
1825077, 中国人不是傻逼！从香港不可能一下跌到重庆
1699680, 这一星，给里面我喜爱的鞋子和裙子还有包。
1639357, 为什么最少要评一颗星，我一颗都不想给啊！
1847411, 又臭又长，选角失败，打戏难看，广告太二。
264512, 完全不知所云。到底是编剧烂还是导演烂～～
260547, 这片竟然在4分以上？excuse me?
269203, 只能说，看到大家都说烂，我也就放心了……
1762, 垃圾，青少年手淫片，中年妇女实在欣赏无能
266493, 莫名其妙的剧情推动 不是原著党根本看不懂
263804, 同时鬼吹灯，寻龙诀要比这部好太多了！烂片
1829269, 我劝没看过的同志就不要看了。看完更难受。
269194, 看过九层妖塔觉得寻龙诀还不错，给特效一分
1644771, 这种烂人拍的烂片都能上映可见现在NC之多
266171, 我只有一句话，这破烂片是个什么鬼？？？？
963048, 看过电视剧之后看的，电影差得不行，恶心，
1699683, 剧情无聊，演技没有，逻辑不合理，配乐生硬
1700831, 个人觉得是烂片中的战斗机。1和2就好多了
963408, 确实和网友说的一样烂，十分钟都看不下去啊
264545, 故事零碎，东拼西凑，毫无因果，莫名其妙。
263935, 呵呵呵......坑挖的深，却TMD不填
261794, 看完寻龙诀 过来看这个....这什么玩意
883385, 很一般很一般的片子。为什么这么多人给高分
263019, 什么tm的鬼！去电影院之前看评分是真理啊
1642528, 这种垃圾片，为什么没有负分，给一星都嫌多
1644597, 看到常用标签里出现了文艺和剧情我就呵呵了
1639324, 脑残欢乐的两小时 1星给可震动 露肉片段
1703423, 心情不好，看完吐槽完就好多了，感谢小四。
268145, 难看死了，姚晨太丑，也不多加点糖糖的镜头
268250, 看完寻龙诀，想起这部还没打分，遂来补一个
1642572, 国产电影就是被这类东西带坏的 小说给两星
1646485, 为了给差评，我还注册了，烂的没法说了四爷
1700829, 要说为什么是烂片，还不如探讨这片哪里好了
266192, 一星给原著。真是一部好shit片的典范！
1641566, 除了猪脚颜值还算高，讲真，没有其他优点！
854130, 打高分的都摸摸自己的良心，值四分以上吗？
938372, 毫无笑点。那些被称为幽默的无非是可笑罢了
270234, 整部片不知道在拍什么，特效太差，没有惊喜
216509, 坚决不给成龙这个鼓吹专制的SB贡献票房！
1702520, 你们确定这是拍给人看的电影？？？？？？？
963887, 一直听别人说难看，现在看了，真的难看啊！
261431, 请别打着《鬼吹灯》的名头去骗钱了，谢谢！
268914, 看在陆川以前的作品上给一星不能再多了……
1641714, 我不知道当初为什么要浪费时间看这部电影。
266829, 没法给半星Σ(っ °Д °;)っ不开心！
1699888, 123全看过，第三步我终于在电影院睡着了
345478, 是我老了吗 满怀期望而来 可真是弱爆了啊
216777, 最烦成龙，居然还有7这么高的分，早点死吧
833355, 我觉得我被一个加长版俗套爱情歌曲耍了。F
1700658, 这种毫无正能量的烂片，简直是中国人的悲哀
1848667, 垃圾，迈克尔贝这有意思吗？你去导央视得了
964211, 进电影院看了一部小学生做的PPT....
267074, 我只想说一句，这TMD跟鬼吹灯有个毛关系
1700534, 去电影院完全是浪费钱！估计只有女生喜欢。
1646956, 我觉得和我们自拍自演的英语口语视频差不多
1639909, 亲身体验以证烂片，这不是奇葩，这是毒瘤。
963052, 好吧，看了就看了吧，看了就忘了吧。唉好困
1699756, 一个广告能放一部电影的时间。。还吐槽什么
1700342, 真好看啊！为什么我只给1星呢！因为我疯了
215438, 超级烂片，政治正确太害人，完全出不了好片
1866257, 第一次看电影在不停看时间……一星给李冰冰
1849114, 除了还是被擎天柱帅的不可救药 没啥好说的
265391, 陆川又出来骗票房了，还准备拍几部烂片的？
965314, 看完，来逛逛，挺热闹，不用多说什么了吧。
265637, 剧情弱爆爱情戏牵强强行第二部一个星给特效
