,comment
400309, 先不说影片好坏，虚假营销，一分不能再多了
154878, 不咋地。都是特效，没有内容  感觉很空！
1963029, 就这种垃圾还想咬千寻？咬动物城？，艹退钱
1571669, 好想狠狠骂 最后千言万语化成两个字：难看
64605, 又山寨宫崎骏，人地个仔都学不像他好唔好。
649072, 我决定再看一遍大话西游以弥补我心灵的创伤
550760, 我是男的 但也受不了这么物化女性的电影 
993701, 实在看不下去。主旋律电影，满满都是套路。
1403203, 王俊凯哈哈哈我一颗星都不想打哈哈哈哈哈哈
119054, 国漫不易，但也请不要这样骗去观众的同情心
749770, 一响起bgm我就恶心  你这情怀真不值钱
993518, 进影院电梯看到一个女生写了太好看了！！！
1400352, 引用一位网友的话：行使我所剩无几的权力。
1399491, 看着尴尬12.29日更新，一星给日人民报
1399464, 电影开场前，旁边的人说了一句:我先睡了。
710917, 这他妈也太尴尬了吧这辈子看过最尴尬的电影
653546, 我就是看不了血腥暴力，这tm一点也不好笑
82216, 一部大爱无疆的电影……看得我尴尬异常……
1214633, 美团上团的票，5毛钱。 电影值这5毛钱！
118891, 如果十二年就只能做成这样，那太让人绝望了
1343268, 这烂片也能上8分，真是佩服水军的敬业 。
399368, 这部电影的成功完全得益于国内畸形的市场。
797140, 不是我的菜。看完只想说什么鬼，莫名其妙。
1403719, 景甜滚蛋吧，一张淘宝店模特的脸，俗不可耐
1403695, 我怕评分系统在约谈后下架，所以，去你的吧
1399832, 讲道理，没有看过就打1分也是需要勇气的。
1399821, 张艺谋果然适合场景的构建而不适合讲故事。
1399840, 看得我尴尬睡着了，such a shit
1399841, 还没看，新闻说有人恶意差评，那就得补上。
155034, 失望透顶，这个节奏 ..........
1215027, 岳父的小说很棒，电影就算我打个鼓励分吧。
511087, 不喜欢这种电影。奇怪的三观，奇怪的笑料。
748950, 这是一部“特效”电影，因为只有特效还不错
108312, 看的我尴尬到一直在玩开心消消乐来缓解尴尬
1214716, 明明是个POLO宣传片，非说自己是电影！
1570176, 根本不想让这种电影出现在我的已看列表中。
1401675, 张艺谋算什么，世界，不，宇宙都是景甜的！
709729, 故事很尴尬，表演烂到家，唯一可看的是特效
1219155, 多年后，小野看到这部电影，默默扔了嫁妆。
1401781, 以前特喜欢看群星电影，现在倒成烂片标志了
549999, 这哪是什么心灵鸡汤，这分明是那碗茴香汤。
1402234, 张艺谋被景甜抬一手之后马上就要超越三枪了
1568171, 没去影院看，算是要回了西游降魔的电影票钱
749445, 对周星驰失望至极，其晚节不保的电影回忆。
1963337, 垃圾就是垃圾，包装的好也就是漂亮的垃圾。
749462, 特效可观，剧情垃圾，一句讲晒：圈钱烂片！
795311, 剧情没有深度，看不出2人的感情基础在哪里
82863, 看的很压抑。一个为了爱情抛弃家族的故事。
119445, 剧情漏洞爆炸  女主怒发好人卡 真tm醉
1402345, 女兵的意义就是跳下去喂狗???.....
994541, 不是特种部队碾过去就完事了么，哪这么多事
1218800, 果断一星。很反感这种没内容瞎矫情的电影。
1566663, 水军太多，只能中和一下了，不过也是够烂的
107905, 粉丝和主创三观真一致，一致的恶心，不要脸
107906, 连CCTV都批判的，你们觉得能好到哪里去
1401895, 本来想给3星的，看在国家面上给一颗星算了
1401422, 景甜你再这样下去，公关更不会借衣服给你了
1216972, 艹，轮到给韩狗的电影1分。韩狗真是沦落啊
1400869, 垃圾电影 看他作甚 50年代的审美 恶心
749127, 编剧没带着脑子，剪辑好像是mv导演弄的。
1402821, 不来补一脚真是难解我在影院时心中的悲愤。
1400703, 毫无逻辑可言的剧情 只会人海战术的老谋子
550688, 什么垃圾，这也是8分，老子给你1分吃吃爽
710462, 一颗星给林更新的演技，感谢吴亦凡的衬托。
1400635, 一句话就讲完的奇葩故事偏偏要用近两个小时
1400776, 全程尿点 张艺谋越来越傻逼了 台词尴尬癌
47224, 谁告诉我脸上抹一层口红那哥们是从哪来的？
1402911, 经过这次想要看一下豆瓣影评最低分能有多低
549423, 笑点满满 价值观不能苟同 给直男癌一颗星
1402550, 这部剧非常好，就讲了一个事情:认识景甜🙃
710252, 烂都烂不出新意，失败。否瓣能打半颗星么？
1401416, 拍的和屎一样，连他妈的富春山居图都不如。
749172, 别再糟蹋了...徐克你承认下自己烂了吧。
1217174, 这种段子电影也叫电影，还不如一步之遥呢。
1400984, 中国电影要有容得下一星的气量——人民日报
2046584, 这个小孩能看吗？完全美国式的洗脑啊。。。
1404568, 所以你们一边说烂一边还是掏钱去了电影院？
1397354, 唉…一星给马特达蒙，愿此片别影响你仕途。
1397450, 江郎才尽的张艺谋，可以安心在家带带孩子了
83855, 这种电影简直堪比毒药，连《小时代》都不如
118537, 闰土与吴亦凡争夺一个叫椿（蠢）的女人 ☝
706962, 看完后我觉得这片子的演员都欠我一张电影票
657204, 疯狂的火车带到疯狂的鹰潭过疯狂的情人节。
1404637, 朋友看过后没账号让我帮忙评个一星（摊手）
706796, 一定是我老了，不然为啥欣赏不了这种假电影
794075, 也就最后五分钟能看，其他时间尿点睡点无数
760560, 看到这卡司，有点恶心人了，这都怎么想的！
547253, 纯搞笑片，一点点的内涵没有，不如有色笑话
406967, 完全靠互联网营销的一部狗屎片骗了爹的银子
107495, 这要是国漫良心那国漫真的可以宣告灭亡了。
1222814, 没电影看了吗？非要在这种片子上浪费生命。
1397609, 也不是特别栏，只是不值我花了20块的票钱
118585, 有零分真的很想打零分，女主就是个大傻逼🙂
118412, 女主一直在做死，太中二，台词太tm尴尬了
1396779, 没有看，但是为了广电总局，特意来打一星。
761794, ？？？？？？？？？？？？？？？？？？？？
750703, 好难看！反正我是不喜欢！感觉好无聊！！！
546892, 去tmd水军。一颗星只给从头到尾的笑点。
750750, 流水账没主题。吴亦凡演技没有，情绪靠吼。
658313, 个人认为是烂片，好奇葩的剧情还是人物设定
551841, 好笑是挺好笑的 可惜三观不正 还是抄袭😑
1396817, 不行就是不行，有钱有人拍成这样是真不行。
1139249, 失望，真的不喜欢这么拍电影，剧情也是乏味
1397096, 不是五星制评分吗？怎么最后变成10分的？
26538, 说了不看这些打来打去的大片，从头睡到尾。
65197, 画面还看得过去 但是这剧情与节奏真的负分
395422, 剧情太差了，99%不走心，只有1%尚好。
1396849, 有duan报给你们站台撑腰，老板你牛逼哦
1396850, 妈的景甜到底什么后台！！！！！！！！！！
1396927, 1分给我的呆萌，矿泉水小姐又把我坑了……
1397002, 如果这都算电影，我申请准许我给0个星星。
1212975, 段子的堆砌 不能称之为电影 韩寒粉转路人
1398748, 一星感谢这部电影让我认识了饕餮两个字🙈🙈
24885, 不能打半星，只能打一星了，比第一部还难看
647859, 经典大烂片，只值一星，另一星给众多的明星
1574490, 这种片子还票房冠军？剧本是我小学作文水平
1347702, 杨颖不适合拍电影，这种片子也能8分，呵呵
118758, 如果这就是国漫的未来 那国漫就没有未来了
1347856, 给一分完全看在我男神黄渤份上，唉....
1222018, 太矫情做作了！！受不了了，看得都睡着了！
1562701, 不是很喜欢这部片子。情节什么的都挺一般的
1398666, 最你麻痹烦打怪！看电影前必须先看简介！😊
1398662, 叫家长算怎么回事？？？这样是会被人笑的。
1403989, 毫无营养，恶俗之至，确又是时代的真实写照
1574384, 真的不好。。。高级的幽默不是这样的。。。
711029, 再也不想看关于西游的电影了。 都快看吐了
1573823, 没演技没笑点没审美的三无电影 太让人失望
64864, 三观尽毁 愚庸至极 技术不够 情怀来凑。
750106, 烂片！！！！！！！！！！！！！！！！！！
1399164, 這一顆星，獻給所有為他付出血汗的劇組人員
750074, 可以打零分吗？实在想不到这一分该给谁？！
1137530, 这部电影让我知道了：豆瓣评价不可以给0分
748866, 为了星爷看的，男主都没注意是吴亦凡！！！
1399006, 烂就烂了，不要嘴硬非得洗白夸。有意思吗。
1398993, 据说长城不打一星都不好意思说自己玩豆瓣。
654443, 有多少人看中的是星爷，而不是影片的质量。
118828, 既然钱这么好挣，为啥还要去用心拍电影呢？
118658, 很水的剧情，全程好无聊！好无聊！好无聊！
1211552, 给自以为逼格很高的人看得，太平庸～太说教
656028, 说好看的是什么鬼 只有插曲能听听看 烂片
156156, 我是来拉低评分的，不忍心看到这种片子上8
750338, 特效牛逼 但是主角唐僧看得我屎都快出来了
1398389, 打怪兽运动会开幕式的大型团体操表演。。。
1347985, 看了水军的8.0我也是醉了，有没有底线了
406453, 史上看过最烂的电影，给高分的你们都疯了吗
547906, 烂片，矫揉造作到极点，粗制滥造，浪费时间
1621991, 不用看就知道是烂片，不用吃就知道是大便。
694818, 这几年白骨精都要被玩儿坏了，两星给舒淇的
1622236, 虽然凤小岳很迷人，但不知道拍了些啥OvO
1622135, 真心看不下，炒作的这么厉害，脑残的电影。
1621664, 这都演的些个神马玩意啊！！！！！！！！！
682251, 真的很难看，纯粹的无聊搞笑，没什么内好的
1621492, 看了一半多实在看不下去了，难受，胃里。。
757292, 情节……演员……咳咳……电影票我已经还了
1621740, 能不能过不给星呢，真心是烂片中的战斗机。
682343, 现在听到将军令和一生所爱有点心理阴影了。
1363932, 这烂片很多人说好看呢…审美确实有点代沟了
1622915, 因为这么多女高中生说它好，所以只能一星了
683088, 几个梗十年如一日用。。一点创新都没有。。
528302, 这什么傻逼电影，看得我各种难受，各种尴尬
1623146, 是否能更无聊一点    不要毒害下一代吧
683067, 为了星爷去看的，算是还了星爷的一张电影票
1173493, 我觉得 这个片儿并没有小时代看着给劲儿！
1622617, 哈哈哈哈哈 这一分是给片尾曲的 大彩蛋啊
1622545, 看完不知道讲了什么？看的中途没有玩手机！
1173561, 别拍电影了……做点对人生更有意义的事吧。
1977895, 感觉没有新海城前几部作品好看，感觉很失望
68456, 这么烂的电影居然达到了6分以上？不可思议
1622738, 高估GJM智商了··········><
1173410, 这是小品还是话剧还是POLO广告超长版？
537303, 不喜欢狗血的青春剧，也不能带入我的经历。
754643, 烂片，某鲜肉的表演烂透，周星驰晚年幸福。
1620157, 拍的哪儿是上海，根本就是山寨版纽约。。。
681594, 浪费时间，一点没周星驰的风格，全程很尴尬
1067982, 真心觉得不怎么样 安妮宝贝标志性的矫情吧
1174687, 尿点多 并不出彩 把分数拉到5.9差不多
695048, 很少为🎬打一星，实在是爱之深，责之切，哎
682116, 这部可能是我近四年来看过的最垃圾的电影。
1621455, 谢谢那些夜夜陪我难过，陪我一起哭的姑娘。
1621387, 擦 什么狗屁玩意~都懒得黑四嫂和小幂幂了
1174820, 感觉看过这片认为好看的人都逼格高高的是吧
1620794, 我喜欢杨幂老师，我希望杨幂老师不要乱接戏
1378266, 夏雨，舒淇都演的不错，但是看完我没有惊喜
684286, 对不起了星爷，真的很烂，千年的梗还在玩。
1625353, 一个字，假，两个字，浮夸。三个字，臭傻逼
694262, 是不是非要自己这么多年的招牌砸了才能收手
684120, 第一次看满座并且全场没有一次笑声的电影！
1624831, 情节凌乱，毁三观，不愧是小四出品啊...
1624988, 装小清新却没拍出青涩，装文艺却没拍出沉痛
114233, 吹的跟什么似的，还多年沉淀，真沉成渣滓了
684859, 周星驰欠我两张电影票，不用还了，快滚吧。
529237, 除了马冬梅人物设定都太渣了，看的很恶心。
1170823, 这是太无聊了，还不如直接在微博上看段子。
1625746, 幸好脑残粉不玩豆瓣，不然这电影能上8分。
1623687, 一看评分形状就知枪手太多，忍不住来踩一下
1623676, 不知所云，渣出翔。一分是因为打不了零分。
1623634, 要不要对打五星的人说，我们不在一个世界？
1623632, 毁了一代人的青春，继续毁这代少年少女……
1364205, 唉，神小说，垃圾电影，各种瞎掰，三流表演
1623573, 忍受了超级大枪版。。。拍的实在是。。。烂
1623807, 请问可以给负分吗？我想献给第一个深夜电影
1623802, 没看 看了百分之八十浪费钱 原谅我的偏见
683606, 什么玩意儿！打一星是因为最少只能打一星！
1623792, 所有人的台词功力都烂透了，只能关了声音看
1623747, 我没看过也不打算看就是来拉分的不客气~~
1623297, 真他娘难看，当观众都12岁么！！！！！！
1623261, 这颗星给郭采洁吧 顺便庆幸一下看的是枪版
1623253, 可不可以打0星，WQNMLGBD，坑爹。
1623231, 真的无力吐槽。。。该吐的都在电影院吐完了
1623187, 打这个分不为别的，就为那些让人无语的粉丝
1623380, 屌丝的励志片……玻璃心脑残少女的最爱……
694599, 周郎才尽 徐克老矣 有这特效 拍啥不好？
50081, 靠，王府井横店太烂，这么暗，啥都看不清！
694610, 周星驰是个好演员，并不是一名出色的导演。
1172804, 公路片?呵呵 汽车广告么 低俗做作的笑点
1623385, 真的受不了这生活的环境！烂片他妈的高票房
683686, 西游还没拍烂啊。这电影还有票房因为春节？
683954, 超级，无敌，难看。从此不再欠星爷电影票。
1624337, b爆了 影院冷气太冷 看得心寒 笑不粗来
683901, 台词太尴尬了，剧情也一般，就孙悟空还可以
1623929, 太烂了，我第一次看这么烂的电影😱😱😡😡😡
1172079, 看睡着了，台词生硬，一股照着剧本念的气息
111645, 如果可以，我更愿意用这钱再刷一次大圣归来
1624032, 能看的都剪在了预告片里，最后还特么没播。
1623978, 完全不知道主线是什么，比《致青春》还烂。
1624242, 节操没了。枪版，快进，真的不是一般的作！
1624205, 哎呀手滑了 本来要给5星的 sb 郭敬明
1624204, 有负分可以评么？上海大学电影系不教剪辑？
757077, 唉，睡着了。电影挺吵的，连碎觉都不适合，
1624137, 我tmd开一万个小号也得把这分给他刷下去
1624100, 卧槽演技简直烂的............
67787, 我跟你们讲个笑话，这部片子制作了十二年！
1179064, 挺烂的。倒是被女儿国国王那段插曲感动了。
1616188, 演员浮夸，导演浮夸，毫无价值的商业电影。
1616155, 电影里要什么没什么，片尾里要什么有什么。
1615613, 顾里的吐槽真是迎面扑来浓浓的四娘的脂粉气
757873, 大过年的为什么要骗我☹️还能再难看点吗!
678630, 自从少林足球以来 周星星的电影就没及格过
1615889, 光是矫情的演技就让一颗星有了足够的理由。
526231, 渣贱的故事，我最讨厌的类型，也并不好笑。
1615812, 说超3分舔脚的现在4.8，该不会要超5吧
74214, 成功塑造了一个集各种婊于一身的女主形象！
19568, 对英雄片实在是无感。。。看RDJ去的哈哈
679459, 终于养成了电影好不好看先看演员表的好习惯
115101, 垃圾电影，费我钱财，误我钱财，毁我三观！
1152498, 为了尊重片中那条狗，我就不说它是狗屎了。
1616221, 陪同事看，还不准玩手机。无聊到无计可施。
1971861, 人物塑造单薄，格局小，依旧是新海诚式MV
1179752, 如果有负分，我一定毫不犹豫打负分，谢谢！
678480, 满满的尴尬，还有为啥要让吴亦凡来演唐僧。
757945, 吴亦凡的演技实在是太差了，还是文章演的好
757947, 简直没法看，拍的什么东西啊？真的是恶心。
111094, 一星给画面，剧情渣到想骂人，拖沓到发指~
370860, 还凑合，及格而已，这分数虚高！给它降降温
1614638, 只能说豆瓣是需要这种电影来娱乐大家的……
1180729, 能别是个人就拍电影还这么高评价误导大众么
757933, 太尴尬了！一星给特效不然一颗星都不想给！
1614194, 怎么会有这么烂的片，，，整个非主流啊啊啊
677574, 真 的 很 烂 准备看十遍大话西游洗眼睛
1614031, 多年以后，脑残粉会为自己的脑残感到羞愧。
1614018, 终于可以打一星了好开森！！！！！！！！！
677618, 土味魔幻自帶的金屬感算不算一種過時的法術
696254, 吴亦凡简直就是烂片的最佳保障～炮王！稳！
677671, 不能给负分吗？千万别去看，浪费钱....
696279, 剧情毫无逻辑 也没什么笑点  一星给特效
1614763, 此剧 完全无须担心剧透，因为 无剧可透。
1615204, 目测前十页评论超过一星的仅5位。[鼓掌]
1615468, 没看过郭敬明的书，这电影真是没什么内容啊
1180278, 段子金句嵌入都好生硬 浮于表面 没有张力
1614974, 一部圈钱的烂片，郭抄抄就是这样赚钱的吧！
1614971, 这是一个富二代才有资格拥有青春的小时代。
1614970, 我都忘了之前还看了这么多国产屎一样的烂片
1614948, 太烂，真的就是来赚钱的，剧情啥的也是醉了
1614944, 郭抄抄还我四部票房钱，欺负我高中时没文化
695463, 毫无剧情，如坐针毡。师徒四人难看到尴尬。
1619184, 感觉被羞辱了，时间被浪费了。好难过。。。
1619177, 一星就是给帅哥美女 情节一盘散沙！看不懂
1176714, 韩寒你是以为自己能像郭敬明一样来圈钱是吧
1618651, 绝逼一个矫情呕吐垃圾片，主演都没有小沈阳
1177103, 刻意的笑话，人物没有张力，死板，看得难受
1618580, 想知道怎麼浪費生命嗎?看這部電影就對了。
1618578, 意淫所达到的高度和郭敬明的身高是两个极点
73834, 不想评价的主要原因是不想说脏话.....
114918, 不冷，你对我就像哥哥一样好。 好NMB。
1619812, 看了小说的人表示，整部电影都在讲些什么啊
754598, 反正欠你的票房也还了，我就按我想的打分了
1619723, 我为自己在youtube上免费看感到骄傲
681352, 特效10分，仨徒弟一分扣一分，炮王扣五分
1153580, 很韩式的抖机灵和卖情怀，但故事讲得超烂。
1379150, 真他妈坑爹，太假了。豆瓣水军越来牛逼了。
1379163, 其实3星够，看不惯水军多如毛，毫无惊喜！
73663, 其实我没有看过，觉得水军太多了，中和一下
1619669, 过了一遍，真是矫情得我浑身鸡皮疙瘩。。。
1619586, 看热闹顺便给个1星，流星花园都没敢这么演
1152736, 什么烂东西，这种垃圾没有资格作为电影评级
679800, 看到主演那几位烂片无遗，尼玛！果然～烂！
1617605, 这种电影我还去电影院看，很想给自己一巴掌
695796, 沒有降魔好!!劇情亂，吳亦凡演技太差了吧
1617044, 一星给胖子 恶心吐了 比天生杀人狂还恶心
115097, 4000人的众筹换来四个字“你个傻逼”。
111211, 大鱼海棠的失败，打了情怀狗一个响亮的耳光
1617331, 妈妈呀！四娘对自己的意淫已经登峰造极了。
757759, ……真是神奇啊，星爷墨镜王是欠了多少钱啊
67943, 剧情反智，人设崩坏，三观坍塌，台词尴尬！
679619, 我想我以后可以说，星爷欠我4张电影票了。
680318, 本來兩顆星，林允出場，一顆星吧。「攤手」
1177363, 我打开了语音版的word吗，画面有必要吗
695559, 特技给一星，其他真的不想多说，中途想睡了
1177162, 真不怎么样，要故事没故事，要想法没想法。
1618320, 不小心还是看了.大家的评价好中肯~哈哈哈
1617760, 啊呀，四娘什么时候给郭碧婷拍洗发水广告？
111236, 情怀说多了就恶心了尤其还是拿不出手的作品
680225, 原来可以骂小鲜肉 现在带着史蒂芬周一起骂
695663, 简直不敢相信这是周星驰和徐克拍出来的电影
1170580, 有些道理，不要听太早，慢慢你就都会懂了。
1634064, 我原来也这么恶俗   竟然一二两部都看了
1158490, 小时代：真难看 后会无期：那都不是事儿！
692587, 徐克+周星驰-=特效。这领悟来的比较悲哀
1633961, 这几天小时代3上映 想起这个占硬盘。。。
689715, 贺岁档，但求笑笑就可以，然而你也不好笑。
967471, 为啥没有负分，圈钱能否不要如斯明显←_←
1633949, 郭敬明不是好编剧，但是是一个厉害的商人。
1633736, 亞洲版的sex and the city
689477, 每年过年期间 都要看大量的烂片来恶心自己
1633602, 很真正地看完，很认真地打分，无任何偏见。
692617, 徐克在干嘛？？？不是拍烂片的导演啊。。。
756230, 最丑的孙悟空、沙僧；最打酱油的八戒、沙僧
967632, 原谅我没法放下小说被拍毁的巨大失望和不爽
689547, 什么鬼 好智障… 怀疑自己看了一部假电影
1633761, 简溪的画风和其他人不！一！样！啊！！！！
1633566, 这一星给当天的一元票价，别的都是呵呵呵呵
1634710, 虽然没看，就冲杨咪咪和郭一五也给一星啊！
967133, 浪费我的时间，浪费我的生命，怒一星，拜拜
967141, 从头到位都是槽点，连吐槽都无从下口的感觉
531937, 就是哈哈一笑的剧，我个人觉得三观极不正。
967181, 只恨没有负分 导演到演员都没有用心 烂片
1634681, 一个0.5给宛如 剩下的所有加起来0.5
1634401, 彻底刷新对烂片的理解 不能打零分好憋屈啊
689887, 就算是徐克导演周星驰监制，你们也是一坨屎
967402, 教主求别哭，我也想哭，我心疼自己的票钱。
967352, 真正好的国产影片的排片都被这种烂片占据了
1163025, 台球那场戏和偷车那场戏还不错，航拍也好。
967271, 黄教主哭得太好笑了何厚铧恍恍惚惚红红火火
692512, 红孩儿那样你问过牛魔王和铁扇公主意见了吗
1634527, 得有多么严重的中二病才会觉得这电影好看？
968135, 烂片。。圈钱烂片。。我真想打零分不解释。
968149, 除了男演员的颜值不够，完全就是小时代四。
1164698, 韩寒你还是别涉足电影了。。不适合你，真的
755526, 打一星是因为不能打零星 真的就是单纯难看
692847, 炮王演智障演的多好啊，不过他低调，他不说
1632699, 嗯。。。演的实在不行。。。编的也不行。。
1164823, 一点生活经验没有，韩寒你拍的这是个啥呀？
1164695, 草你妈逼 自称为文艺的傻狗。浪费老子时间
968257, 看到最后我以为左震和林萧在一起了。。。。
1632365, 我在想，第二部还会有这么多人气 看吗？？
1632303, 还好豆瓣没有零分和负分 否则我一定给一个
968229, 太难看了，不花钱都觉得侮辱了这张电影票！
1372855, 看完后，同事问我演了个啥，我说扯了个蛋。
1887472, 没有任何感动，看不出是一个故事，乱七八糟
967810, 妈个逼的，一分都不想给，看着看着就睡着了
17294, 看了半个小时就从电影院出来了 浪费我钱！
689199, 看过最难看的电影没有之一，连烂片都比不上
1158206, 就像去了一趟天涯海角，但却什么也没记住。
967856, 看到评价一天比一天趋近二分，感到非常欣慰
356662, 票房高并不代表质量高，不然你看看小时代。
689170, 看完我就去看段小姐了，西游降魔篇好看多了
967973, 看完脑海中一直回荡着“情深深雨蒙蒙～～”
1633019, 也不知道自己哪根筋不对，翻来这片子看。。
1158097, 充斥着各种无聊的梗也是无法掩盖剧情的空洞
69513, 看完电影小鲜肉说松子哥一看就是gay哈哈
756280, 大过年的带爸妈去看这种电影 我是不是有病
689080, 就觉得林更新不错！至于其他的演技是硬伤！
966302, 剧情分散烂俗 镜头色调美无敌 （黄薇监制
691980, 吴亦凡算是把周星驰的招牌彻底砸了。。。。
70130, 真的别去看 听听歌就可以了 留个美好回忆
1160634, 除了失望还是失望，韩少和小四有什么区别？
966227, 我进来豆瓣电影一看以为是“情书”上映了。
1636713, 大学宿舍唯一一起看的电影  一星给回忆！
