,comment
1236500, 胶粘。稀碎。我不知道这烂片到底要表达什么。
1366599, 非常失望，吹了半天，居然是这么差的一部片！
1468536, 别说正片了，就预告片里的景甜都是秒秒钟出戏
277330, 这剧情是拿来哄小孩子的？导演能自圆其说不？
1592619, 哈哈哈哈！谢谢小时代带给我这么多笑料~！~
1620739, 郭敬明是新闻联播派来的吧，全国人民这么有钱
674367, 尴尬极了，要是分级了，肯定PG-13往上啊
685258, 近5年去电影院看过的最差的片子，一星给特效
277240, totally shiiiiiiiiiit
9585, 看过的最烂的卖座影片。从此不再看漫威电影。
1592727, 我看的那版里怎么中间还有动画片啊！！！！！
76066, 浪费钱啊。。什么玩意。。还是大魁拔好。。。
984227, 只有标题是真的，战术和剧情方面的智商为负。
1493150, 恶心死了恶心死了恶心死了！重要的事情说三遍
747793, 事实证明即使是星爷'也拯救不了没演技的演员
1645431, 这也叫电影? 主演全在卖脸..毫无演技可言
276987, 额，没看过原著，不知道……只觉得，电影好差
276988, 还我胡八一，还我胖子，还我Shirley杨
1593753, 浪费钱！电影金玉其中，败絮其外，华而不实。
453123, 给那个谁颜值一分 其他的实在找不到加分点了
276823, 难看到难以置信，幸好还有赵又廷的颜可以看看
958019, 我一般真的不苛刻的。但是这部电影太丢人了。
1656701, 竟然有5.0这不科学，贡献出我的第一个一分
1594092, 垃圾垃圾垃圾 電視不播才不會花錢看這種東西
256618, 哎 从没见过这么惹人嫌的恋爱 什么玩意儿嘛
1493048, 。。。比匆匆那年好点。。。马思纯演的还不错
1185406, 想炫耀那几句话，发个微博就够了。要不您优酷
958012, 哈哈哈哈哈哈3.6这是我看过最低的评分了吧
1593999, 一部无力吐槽的幻灯片，这一星是给电影票面子
453134, 与何以笙箫默并列今年最差电影，怎么烂成这样
1468883, 一场盛大的智障狂欢，国师你只适合导奥运会了
697401, 特效一分，，，烂片一部，还把坤神拍的那么丑
469990, 吃大蒜的低俗梗，还想说出哲理来，欣赏不来。
1977280, 一般，可能对这种风格不是很感冒，两星给画面
1593452, 这电影竟然到现在还有两星半的评分，不科学！
1656931, 为毛这样的电影广电还放行了？百思不得其解！
19075, 第一部就已经有烂片的迹象，第二部不烂才怪。
1656915, 傻爆了，还不如当年我认为弱爆了的还珠格格。
1593333, 这部电影…………用“恶心”两个评论就足够了
1620618, 看一群浮夸的人秀着浮夸的演技骂着傻x的人生
1620621, 我和我的小伙伴们都惊呆了！如此低俗的烂片！
1493188, 看预告前五秒就立马打一星   恶心死我得了
674691, 吴亦凡？？我去年买了个表！可想而知有多烂！
1656894, 嗯，就是看了电影名不爽特意注册个号打1分的
1301346, 读过原著小说的就别来看了 家里睡会觉也不错
1656874, 为了圈钱，硬生生一本书劈成了一个残疾电影。
277048, 为什么不能打零星，唐83真的演的low爆了
277058, 什么鬼？看了一部特效大片，与原著有毛关系啊
1611374, [补，刚刚误删了] 小时代，小众人的世界?
1699082, 这电影告诉我们    长得漂亮有钱才有青春
1611387, 一分给那个看最小说还能津津有味的我的高一、
373018, 吹上天的国产动画片简直自欺欺人，贻笑大方。
547958, 小品电影，我也想知道这部电影是怎么刷分的。
1611285, 一个字，烂，两个字，很烂，三个字，非常烂。
633125, 人设好粗糙好丑恶，恶心得不行。笑不出来的。
681644, 一星给星爷，吴亦凡的面瘫。。。呵呵呵。。。
1611567, 看完我只想说，导演你把我那两个小时还回来。
1647241, 一个2B导演加上一群3流演员。。。鉴定完毕
1347786, 垃圾的够呛   陈坤一张便秘脸   好恶心
1823036, 惊破天拉低整体分数~~~这也叫变形金刚？！
548100," 刨除段子, 一无是处. 然而我对段子免疫."
961157, 真心不怎么好看，好小说都让这垃圾电影给毁了
1611459, 没看过原著，各种 穿普拉达的女王 的既视感
1342928, 只为陈坤而来，但为啥是这水准... ...
1611512, 為什麼將2部戲的片段，放在一部戲的預告裡？
681722, 渗人的CG 打斗，恐怖片的画风，可以滚出了
1342824, 彼岸花，就是一朵便秘的菊花，喷出黑色的石头
1647190, 一星拿好不谢 实在怕四娘跳起来打断我的脚趾
1610918, 一星给中学的时候还追过连载……也就这一星了
681585, 不会再为情怀买单，再也不欠周星驰电影票了。
1611142, 被朋友拉去看的，史上最烂的片子，没有之一！
1611098, 好垃圾的电影一直发梦   居然让杨幂做旁白
1611109, 导演一定把所有的精力都用来拍海报和预告片了
456080, 预告片都那么难看，一星给女主角和蒋劲夫的脸
548132, 我的审美观已经和大众差的这么远了，很难过。
1648917, 太烂了 里面很多狗血的桥段 完全不符合逻辑
1612284, 我只觉得脑残片吃多了的人才会喜欢这种脑残片
259895, 我特么是脑门被夹爆了才会看这片子的吧！！！
1612090, MV？我宁愿看IG对LGD，诶，失望怎么写
695087, 一星给特效吧。星爷为什么会监制这种烂片呢。
53484, 果然是期望越高，失望越高。跟机器人打的好坑
1612487, 虽然没看，但5分太高，我只是想再拉低点分数
133043, 一张海报骗我们十二年，如今拿垃圾回报我们？
750048, 除了蜘蛛精的胸好点，其他，诶，其他有什么？
1647256, 一星给我和闺蜜吐槽一下午的欢乐 不能再多了
961234, 一言难尽…… 连韬韬都挽留不了我要弃片的心
1649103, 郭导演真的很能捣，把我的眼捣的都睁不开了！
719696, 平衡下，不喜欢吴亦凡！不喜欢林更新演悟空！
1611809, 居然还有五分，看来人民群众还是敌不过水军啊
1616565, 原谅我，一颗星给大魔都。魔都你辛苦了=L=
1611761, 嗯连B站都没让我看完的奇葩 40分钟关掉了
1699134, 能给个负分吗？不给个负分，对不起我那双狗眼
1611701, 少女的春梦 成年后就算说起也应该是当做笑话
56814, 烂片，难看。鸡汤都写的那么烂，还指望什么。
1246070, 不知道整场电影在讲什么 和同学看的要睡着了
1649130, 垃圾！超级垃圾！！！ 特码的！侮辱我智商！
1612069, 不用看就知道是烂片，不用吃就知道是大便。。
135673, 粉们，美好的事物不需要你辩解，它自有力量。
1612023, 太烂了，电脑上看了一半，实在没有勇气看完了
548306, 看前认为很不错，看完我觉得我错了，弱智电影
1096979, 狗血的剧情，巨雷的设定。BOSS你好惨啊。
1822575, 迈克尔贝烂片之王，李冰冰演技超差，颜值负分
962077, 垃圾，给一星是因为最低分就是一星。-_-#
1647100, 居然还有4.8分。真你妈奇迹。豆瓣收钱了？
1609652, 枪版 小学生作文拍出的东西肯定也是low货
107456, 上古有大椿者，以八千岁为备胎，八千岁为湫。
1616927, 主要没有比一星更少的星星了 只好给了一颗星
272241, 超级无敌大烂片，根本不知道主题是什么！！！
259475, 2個小時看了一部渣到不行的電影......
1473349, 整部片子的调调很让人难受，一点都不招人喜欢
879736, 我操一点儿不好笑好么！！！！LOW死！！！
374614, 画面用心，故事却没讲好我就是想平衡一下分数
73733, 之前不想骂他，但是和大圣归来比真的是绿茶婊
272441, 这100多分钟简直就是折磨！！！差评！！！
680807, 九七之后再无星爷，只是我们不愿意接受而已！
1245369, 毫不掩饰的低级抖包袱，我还不如看郭德纲呢。
962101, 完全不明白这部片除了圈钱以外还有什么意义？
1650125, 时装t台秀，也算电影？郭敬明你能再烂点吗？
739848, 剧情巨烂，一分给特效（其实因为不能给零分）
72672, 白瞎了这么好的画面和配乐，剧情真的是很无语
1473348, 还好青春小说看得少…欧豪背影好像学长嗷嗷嗷
1704757, 能不能给0分啊！给一星我都嫌多，庸脂俗粉！
1609456, 特地登陆上来评1星，这都什么东西！！！！！
1473297, 只想说，三观不正。陈都灵的哭戏，太搓太假。
456009, 很不开心居然没有负星，微博观光团到此一游。
1079915, 大雜燴的東西總是難看...........
456010, 纵观何炅演过的戏+李易峰的演技 一星太多。
1647166, 尿罐里和面，天然馊饽饽嚼着喂给大头娃娃们吃
1649663, 可以给零分不…剧情生硬，空洞无物，演技捉急
1704640, 除了帅哥美女，其他的，不知道它想表达什么！
1610526, 不切实际，矫揉造作，感觉很假，打瞌睡的节奏
1649624, 我看小时代 为的是有跟朋友扯淡调侃的谈资…
1175719, 从导演到演员全部拉入黑名单，包括路人贾樟柯
961020, 还我以琛 教主的下巴太出戏 一星给那英的默
547567, 剧本缺少了深度。小品式幽默，上不了大荧幕。
259683, 豆瓣诚不欺我也。实在想不出这片子存在的必要
681435, 烂透了，笑点剧本都一塌糊涂，简直要看到睡着
1894164, 能让我看了25分钟就睡着的也没谁了，在下服
683762, 两座大神崩塌了。白瞎了我的眼睛。贺岁片全跪
1610807, 只能用十三来形容，当然看得人也有点不正常。
1610694, 就是想看看这部电影有多无聊，结果真是很无聊
466855, 假惺惺的一部电影，主角贱的，乱打扰他人生活
681362, 看一半睡着了。。。没有剧情的特效纯粹辣眼睛
373966, 带着预期去看的，结果非常之失望本来想给3星
1894417, sorry 我为了平衡一下分数 一星给画面
1610029, 这部电影没配音绝对是最大的失误！宫铭最棒！
547174, 果然评分和评价还是要等下映了才慢慢科学下来
272121, 陆川是谁？哦，拍那个九层妖塔的...呵呵！
1349023, 大烂片。。比九层妖塌还烂！豆瓣已经沦落水军
1610266, 小时代拍成电影相当于在公共场合手Ying。
1616860, 剧情浮夸，不知所云。杨幂演技一如既往的烂。
133167, 不明白，在土家族族人的附近是怎么有海的……
1753700, 智商低的虐心。不看韩国电影的决定需要坚持。
717626, 不能给0分，真是遗憾啊。大过年的让我睡着了
107895, 全程看着碧蕊白莲自己感动了自己，气哭了！！
1614703, 不想再吐槽更多…电影看完都没发现高潮何在…
1699489, 看帅哥美女，看里面的衣服，电影本身毫无意义
682777, 说欠电影票的，应该都还清了吧。#和洲影城#
739421, 胡扯！化妆看着恶心！跟大话西游差十万八千里
1614190, 一颗星 给最后5分钟 其他没有什么想说的了
260153, 看30分钟果断放弃。用枪打蝙蝠我也是醉了。
739403, 吴亦凡手动再见，不要再出来恶心人了！！！！
1474981, 其成品与《致青春》相差了1000个小时代。
1474958, 呵！醉醉哒 还不如那个10分钟考完这部戏好
961629, 整部笑到吐 第一次感受到什么叫僵硬和零演技
1487228, 也许我已经不是目标人群了，情怀和青春，呵呵
1647450, 小屌丝要如何能理解那些高贵冷艳白富美的春天
1173664, 不知道要讲咩，王珞丹好婊，看到她就没兴致了
165532, 美冬党表示心累，编剧是多讨厌我家巴基。。。
260295, 看的时候一直在吐槽，第二天想了想，我没错😞
1615417, 以为看了富春就无所畏惧 原来我还是太年轻了
1615430, 婚纱摄影很奢华很美，这个值一星，吧。（?）
577827, 看不惯那一股子高傲劲儿，冗长傻逼的两小时。
1704123, 这部电影是郭傻逼边和她母亲那啥时拍出来的，
749130, 这么烂的电影，居然有这么高的票房。我无语了
1704110, 小时代其实就是一个商品展示，感觉是个烂片。
961865, 呸  票钱不是我出的 但是这部片子烂出天际
1172776, 真是太难看了吧，还不如四娘的死逼时代好看呢
1615567, 看不下去，垃圾的导演，垃圾的主演，浪费胶片
849901, 真难看，看了四十分钟就离开电影院了，受不了
683431, 一部从头到尾东拉西扯的不知道在干嘛的玩意儿
1614979, 杨幂还是请个配音吧…演技竟然可以如此做作…
1647537, 我只想说一个字:what the fuck
1699599, 真的全都脑子不正常...反人类反社会啊简直
1823784, 只有我一个人觉得冗长无聊屁股坐穿看不下去吗
1883039, 我经常摸你的胸，但是我还是忘记了你的名字。
961735, 如此狗血的剧情，只能骗骗青春期那些无脑少年
1095644, 情节枯燥，场面干瘪，剪辑松散，整体愚蠢……
1647754, 这种垃圾片还能赚高票房，看来脑残者太多啊@
1615202, 最烂的观影经历，尽管身边坐了近期最棒的人。
749018, 期待了好久实话实说一部不如一部，我那个恨啊
749017, 莫名其妙，你们给我上个成片不行吗？浪费我钱
1615108, 神啊！这TM是地球人拍的么？ 美术摄影不错
1616327, 抄袭不会让你成功，行为你得行为总会被人揭穿
1613002, 刚评完不二神探，怎么着也得给一分给柯震东。
1699653, 初中的时候看过书，所以才来看的电影，就这样
1346567, 被广电总局限制了，剧情不好，五毛！特效不错
1704360, 没看，但脑残给08.11号，看了，有负分吗
961387, 太浮夸的演技，不自然的表情，不合理的剧情。
271526, 什么玩儿 最扯的是片头根据精绝古城改编……
1612926, 丧心病狂推波助澜演绎恶趣味的时代灾难巨制。
1704348, 能不打星么，看完预告这是要毁了我的人生观啊
271442, 看了10分钟就开始无聊了，最后我竟然看完了
1648600, 没意思，太虚假。对电影和郭敬明一样没好感。
682288, 可以给负星吗！！！你是蜘蛛吗！我也是只猪！
1346390, 无聊之外还是无聊，感觉画面上还不如九层妖塔
1616302, 为拉低分做贡献。婊子们搞的我彻底不想看了、
1239199, 剧情无聊，充满了各种各样的心灵鸡汤，无聊~
135622, 画面配乐85分，加上剧情台词配音，40分。
749989, 只能说一般，不值得到电影院看，浪费影票……
1474098, 这一星全都给杨洋的颜值！帅得我想舔屏！！！
271611, 我他妈就不懂了 鬼吹灯不他妈是盗墓吗？？？
750012, 补上了这张电影票 之后拒绝再看周星驰的烂片
1612621, 做作到死，一颗星给最后的随机演讲和集体抽风
1704401, 看过这部mv之后强烈觉得豆瓣有负分的需要！
260498, 红犼像黑暗侵袭里的怪兽，还有，什么鬼玩意！
1648742, 我就是来看豆瓣ID男儿本色 跪添幂幂脚的。
1487402, 希望这样的电影 不要再上映 女主演技差到哭
1613654, 到了电影院你们跟我说超人看过了 人干事！？
1616195, 对于这种影片能赚到票房我只有两个字：丢人！
1648355, 90后的喷潮G点我表示不理解~而且貌似很低
1704255, 没看过，就是专门来打1★的，不谢！再见~！
1613931, 这么脑残毫无内涵的片还有3个星......
1699429, 看完就呆了，还不如看还珠格格三那个脑残剧呢
1613818, 暴发户吗大哥，杨小姐的演技还不如朱桢啊拜托
910766, 好吧，我失望了，我真的没有找到笑点。。。。
1613827, 伪娘的小时代？里面男人有一个不像女人的吗？
1487467, 真心不好看，故事平淡无奇，男女主角也不出彩
1613858, 一星给唐宛如……其他的都是什么xx玩意……
1616156, MV合辑么，要不是和你一起，我干嘛去看……
1699410, 那些给5分的是给中国的撕逼事业做贡献呢吗？
749766, 一星给特效意思意思吧。可惜不能打半星跟无星
1154255, 七点八……何等水军……一星给陈柏霖の帅脸。
1849821, 第一次和妹子单独去看电影竟然看了这种烂片…
1174185, 终于忍不住说我看过这部电影。一星代表一切。
1154226, 当年也是脑残粉的我必须说一句：太他妈难看了
1647378, 见不惯这4.8的高分，专门注册进来打下分。
1704068, 我打五星，不好意思，尿急，手抖了一下点错了
1613547, 恕属下无能，看了十来分钟，实在坚持不下去了
1648384, 看了一半的样子，实在撑不下去了，原谅我~~
961480, 难看到无以复加的程度。如果可以，负分滚粗。
1604337, 为了吃鸭舌消遣来看的，真是可惜了我的鸭舌了
1471904, 我们三在电影院笑到被旁边大哭的妹子翻白眼了
543634, 恶心至极的意淫，喜剧片也是要有三观的好吗？
752140, 一分给特效，大年初一带女友看西游，真心失望
1604189, 要吐槽的点真的太多了啊！不要浪费钱了好吗！
454904, 2月开机4月杀青7月上映，我什么也不想说。
1490121, 这是我看过最难看的电影没有之一  书也难看
1652020, MTV就在练歌房里看看就好。还可以随时切歌
1617931, 四娘脑残粉求别再代表90后了膝盖都烂成渣了
543726, 看的我好恶心。。。。真的恶心到了。。。。。
341759, 不好看为什么分数这么高😓 连小朋友都不喜欢
1475454, 因为是自己提议去看，回来的路上一直很愧疚。
1471966, 喂喂喂....这片子三观非常不正吧喂...
831671," 男生看了打1分,女生看完打5分,我是男生."
1698347, 一颗星，送给曾经爱的这本书和当时脑残的自己
695940, 真的 太 难看了 孙悟空你为什么不搞死唐僧
1652291, 半星给接烂片的郭采洁，半星给搞笑的侯祝姐。
752278, 给吴亦凡一分，全剧无中心，不知所云，失望。
1705258, 受不了的人永远受不了~喜欢的脑残粉依旧脑残
274073, 确实比孔连顺的特技好，可情节真的不如王大锤
752315, 还是有些许的失望吧……(｡•́︿•̀｡) 
1618046, 豆瓣评分从2.9涨到5不知道发生了什么事。
1652260, 原著是屎，电影更是屎，一星给女神郭碧婷的脸
1179451, 和它所要嘲弄的都是sun of beach
748392, 一星给特技，师傅跪徒弟～戏虐无耻到无以言表
678765, 周星驰加徐克 1+1=0这化学反应确实够大
1652169, 完全在意淫的电影，不过这也是脑残们的G点！
543482, 被豆瓣评分骗了，一定请了很多水军，顶多4分
258411, 满脑子问号看完，没有一个地方是让人不闹心的
1652232, 基数这么大，评1星都拉低不了分数了呢！！！
274043, 小学生编剧，中学生剪辑，支离破碎的一部电影
468115, 被那221万的索赔给恶心死特来为电影方打分
752247, 卧槽，啥玩意啊，是不是时长不够东拼西凑啊！
979837, 虚高的分数，这片子7分到头了，回归原型吧。
1471982, 好难看……无缘无故撕逼的水准都比不上小时代
376780, 8.7分把我欺骗到电影院？怒打一星平衡平衡
1617837, 有多少人是怀着吐槽的心情走进电影院的啊？！
74242, 画面值五颗星。逻辑减五颗星。同情加一颗星。
1698469, 衣服和镜头都很美，就是剧本有点糟蹋工作团队
1651589, 冲着喜欢了这么多年的郭碧婷，我多给了一颗星
1646595, 前50000年，后50000年，无出其右。
1705120, 价值观俗到底，仅仅是画面漂亮，语句华丽而已
1705117, 陪人去看的，没有办法更差了，可以给0分么？
109842, 为什么豆瓣星级最低星是一星，我想打零星的。
848690, 打一分是为了拉低这个高估的电影，其实值3分
751919, 看过的最烂的片 没有之一 对周星驰太失望了
197682, 叫美国队长，但是没有好好塑造美国队长的烂片
960125, 我在飞机上看的，下飞机骂着街找国航退票去了
1605329, 这种电影不给0分，都是助长中国的烂片气焰。
1698365, 里面的男主挺帅的，就是我认不出谁是谁。。。
258530, 乱的令人发指～求不要拍续集，放过鬼吹灯吧～
185134, 睡着了三次，人物太多角色混乱。完全不用3d
960029, 故事的流畅性很差，看过原著都有些看不下去。
1617912, 花钱受精神污染，军训15天的吐槽燃料有了。
273814, 负分滚粗。看了不到10分钟尴尬症都要犯了。
960001, 我特么就想问一句，这部电影拍出来有什么意义
258559, 中国电影有个rule：只有更差，没有最差。
455057, 何老师继续当你的主持人吧，学人拍电影做什么
1077709, 开场10来分钟就看睡着的爆米花式主旋律电影
258556, 不想再看到赵又廷演戏了，没有演技还要当主演
1651751, 没看懂。什么意思！还有宣传片里的都没有啊？
273757, 破片，白瞎票钱，白瞎拍电影的钱，白瞎时间了
1705164, 女人给女人拍的电影，基本男人都是看不懂的。
258545, 妈呀太难看啦！看困了，准备再看一会直接睡觉
1247098, 用风尘和沧桑绑架自以为是的观众 与传销何异
455036, 男主长的太丑，演技太浮夸，女主丑的不忍直视
678632, 太难看了。。都睡着了。。吴亦凡什么破口音啊
274296, 我拒绝道歉，盗墓笔记这种烂片我都不会去看。
341219, 永远在跳戏，说故事的水平还真心不如一个mv
1471413, 男朋友因为我高中看过这样的小说，震惊了！！
1471409, 吧啦演的最好，男女主角的死人脸再好看又何用
454680, 然而花了9块钱看完这部片都觉得浪费钱。。。
1652699, 郭敬明你敢黑我大浦东，拖出去枪毙一百万次！
1602945, 不知道在演什么 如果上初中的话没准会很喜欢
274224, 大烂片呀大！烂！片！ 有空明天吐完整版的槽
678179, 第一次万达和imax居然要献给这部片 想无
454691, 主演演技太差了，叙事不行，整场就是疯疯闹闹
274265, 剧情烂，演员演技烂，一星给特效，陆川吔屎吧
752607, 失望至极，看完后脑子里完全没有剧情的影子！
1646388, 国产电影还有救么，影评一句话，日你妈！！！
378419, 别无脑支持国漫 这个剧情不咋地 但制作可以
173852, 特地来拉低评分的，1星给动作指导。2333
1471463, 再也不在电影院看青春了，连进度条都没得拖！
1356414, 唯一的一星是给画面的  我导游的都比这好看
542038, 不知道评分为什么这么高，起点yy小说的剧情
1602411, 如此脑残的一部片子我就不浪费语言去描述它了
197415, 作为漫画党，认为战斗两方都有部分官方OOC
454562, 说好看的都是说：我主唱好帅啊啊啊啊！…哎…
552769, 水军太多，本来应该是给三星的，就给个一星把
1705486, 还有比这更烂的电影吗？专门给脑残拍的ＭＶ！
258125, 有生以来还没看过这么烂到让我震惊的片子……
1699905, 开头那一部分我实在相当无语，那不就是小品么
1471513, 卧槽，什么B的剧情？！还左耳进，右耳出！？
454713, 现在的内地电影真没落，这样下去还能有进步吗
1306050, 故弄玄虚，什么破玩意儿，浪费时间看这种电影
274165, 表示…一点都不好看…我到底在看什么电影啊…
1705366, 只能说看的快睡着了，小时代四肯定不看了。。
258325, 赵又廷为什么还在演戏？陆川为何还在拍电影？
198768, 这部有点闷了，毫无亮点，很多人看着在打呵欠
1603413, 一星都不想给5.0的分数实在是看不下去了。
737827, 这是第一部让我中途🈶️想离开电影院的电影！
1471750, 還是像當年一樣理解不了。左耳聽不見去治啊！
1705324, 为什么不能给0分？这简直就是强奸民意啊～！
110087, 只感觉团队吃相难看，炒作不止，卖情怀没能力
274111, 要求退票！！！！(虽然是五块钱买的特价票)
1603582, flash的画质如此逼真，我整个人都折服了
274091, 谁能告诉我，豆瓣怎么打零分........
258359, 什么什么跟什么 啥都没交代 就结束了。。。
552623, 女主角不漂亮，还不如我在网上随便找的一个呢
1705401, 剧情重复，肉不够鲜，影院看皮肤也不好，郁闷
1821259, Bicocca电影院意大利语版的，很费力。
1603157, 撇开垃圾剧情不说，拍摄手法也是幼稚到可笑。
1471518, SB片子，屁大点事儿就这样，你们活着干甚。
1618237," 大家可以说简短一点么  两个zhi, 垃圾"
1652623, 浓浓的小四风，笑点制造的刻意，剧情华丽空洞
1652609, 终于看了小时代，终于可以毫不顾忌的给一星。
258228, 原谅我没有看过原著，所以这是什么跟什么啊！
959716, 坐在我后排的男生在电影开始十分钟就打哈欠了
258254, 这满满的中二味道，和盗墓有半毛钱关系么？！
752471, 我觉得最精彩的，全是上一部的镜头。水军加油
752475, 个人给这部电影打10分，如果总分是💯的话。
1151959, ”但是我会毫不犹豫的给《后会无期》五颗星“
1355886, 这片怎么能有7.7分，豆瓣也被水军占领了么
1850910, 一星给萌萌哒恐龙。至于其他。。。呵呵。。。
