,comment
1433750, 对老谋子的电影无感了，他已经透支了对他的信任
1433611, 记住要有能接受负分的胸怀。尽管豆瓣不给打负分
1434025, 很失望，说真的！没有什么剧情，就只有看风景了
1434006, 电影工业发展到今天，观众已不在是人傻钱多了。
246821, 烂片一部，整部都在宣传主旋律，成龙式红色电影
1433948, 对于这部电影我的评价就是： so FUNNY
291997, 我还是去小说吧，什么东西哦(´-ω-`)差评
1266749, 我觉得是我这辈子看过的最难看的电影，莫得之一
1434420, 没看过，就是专门来告诉人民日报：你很恶心的！
1719178, 最垃圾的丧尸片没有之一，严重模仿韩国的感染。
614126, 拜托星爷你不要再砸自己、砸西游的招牌了OK？
1435100, 因为人民网的脑残社评，所以我给一个电影一颗星
1435192, 垃圾爆米花电影，和社会主义核心价值观背道而驰
292131, 烂到死，浪费票钱，剧情烂，原著党千万不要看。
1434662, 实话实说电影没看，只为日人民报半夜赶来投1分
125054, 也就画面好看点，剧情真乱，在家用电脑看看就好
1267500, 特意注册一个号，只为平衡一下与实际不符的分数
291732, 情节混乱，三部曲，所以第一部是这样？特效还好
1267362, ……没有让人感觉到他的用心，真是让我寒心。。
1859069, 这部片子是在是大烂片，目前系列里最烂的一部。
1859107, 美国这类型电影 我真的是一部都不喜欢。。。。
291623, 是生化危机吗？我看的是9元场，一样大感不值。
124842, 无聊透顶，画面和配乐可以加点分，其他就是垃圾
613349, 垃圾，不值一提。如果你想让胃难受，最好选择。
1432577, 我不想打一星，但是豆瓣被绑架我实在看不下去了
1435320, 烂片就是烂片，找人民日报就能改变烂片的事实？
1438329, 当连一星都没得点的时候，才是真正的饕餮末日！
92752, 这个电影看了一半真是看不下去了 三观太不正了
1438215, 没有剧情的垃圾片@！！！！！！！！！！！！！
1438587, 不让人说电影真扯淡，背景那么大干嘛要拍电影啊
1952663, 真的看不下日漫了 矫情的厉害 打一星综合水军
92881, 什么诚意之作？这是一部真的想骗钱的诚意之作。
125644, 我头上有犄角犄角，哈哈哈……如果能评0星的话
246328, 不好看 一点也不好看 剧情太俗了 没什么笑点
205886, 就算把成龙演砸的废镜头剪在一起也比这个片好看
488611, 我如何被评分水军忽悠进电影院  是我人生耻辱
1439731, 老谋子正在努力和郭敬明争抢，年度最佳烂片大奖
725186, 一星给特效 其余一无是处 千万别再出第三部了
125879, 讲不好故事一切都是零。一颗星给你所要的情怀。
488783, 现在才看，真是搞不懂上映那会儿怎么会那么火的
725638, 说实话 就林更新好点 其他人的演技我上我也行
190178, 电影院看的 看的都困了 这么高的分一定是刷的
1435401, 睡不着的时候，最好的解决办法。找景甜的片子看
725681, 星爷，欠你的电影票还清了，再见不送，大烂片！
1435711, 剧情什么鬼，演员王俊凯景甜是干什么吃的这么假
292602, 这根本不是鬼吹灯、胡八一也不是胡八一、垃圾！
292594, 烂片！但是特技不错！赵又廷属于面瘫型的演员！
489898, 平衡分数… 哪这么多水军… 三观不正无法苟同
1264835, 后会无期，韩寒。以后再也不会去看作家拍的电影
1265179, 可以打半颗星嘛！今天最难看的国产电影非他莫属
725581, 比隔壁功夫瑜伽好那么一丢丢 至少有逻辑背景？
1436959, 剧情空洞，逻辑性差，爆米花片，不会看第二次。
489987, 每天吃饭的时候看 看了一星期 对结尾太失望 
252142, 编剧应该要给原作者道歉，不，还是直接下跪好了
1392655, 听说被批评了？我就是不喜欢看，公主能奈我何？
252116, 神马玩意！也就雪山那段像那么回事，陆川，呵呵
1392891, 30块买了两个小时的尴尬~除了配乐一无是处~
1392750, 拍的不好还不给说了是吧？见不得这种歪风邪气。
732287, 吴亦凡太帅了所以演技不在线，这是最好的借口。
1392253, 垃圾片，我觉得一颗星对景甜大明星来说都是多了
1062878, 烂到无以复加，居然拿双黄，看来金马奖，，，，
58777, 好心办坏事还不如一个坏人来得带感，三观差太多
1392317, 这么多一星评论还没拉到2～3分 这不合理哦～
1393555, 一坨屎，毫无剧情，电影院我居然睡着了。打怪兽
283756, 叫红猴的小怪兽简直就是dmc鬼泣里狂怒的翻版
1393400, 张艺谋终于和80 90年代的自己挥手告别了。
1393352, 电影看到一半 就忍不住打一星了 全程尴尬……
1393346, 杨时旸：豆瓣和影评人搞不垮中国电影，烂片才会
1393676, 属于钱多没地折腾的典型，景甜又添一“代表作”
1393643, 电影界的人们为了捧景甜真是不遗余力啊！！！！
1393642," 看演员阵容送一星温暖
（负分送给人民日报）"
1734340, 不关门这个大bug在，让我整剧看的都特别别扭
252102, 吴军老师演得好 克拉玛依黑得好 其余全程二逼
600211, 一切说这部电影好的人都是他妈的托！！！！！！
252081, 是挺不好看的。大场面没有，故事结束的很敷衍。
1393136, 虽然票只花了十块钱，但是张艺谋你赔我十块钱！
252405, 新买的电视正好拿它试一下，10分钟给我烦的。
283279, 故事拖沓，15分钟可以搞完的硬拖到115分钟
1390877, 导演一本正经讲什么色彩美学文化传承，太好笑了
283145, 强奸我的智商  赵又廷的电影没一个不是烂片的
283187, 整部电影完全就是导演在侮辱观众们的智商，退票
283180, 真的，很久没有看过这么不合理的片子了…微笑脸
1390340, 说实话，没看电影，看了下演员表，给个零分吧。
1391862, 玛德，看了知乎上的分析，简直不能忍，1星滚粗
1391777, 加油我瓣!从被刷屏才晓得这个电影~根本没看~
1392045, 豆瓣恶意评分？没有的事情，赶紧打个一星压压惊
1392004, 没看过也打分要你管啊？不贡献票房，贡献个一星
1967040, 被所谓二次元人群捧上天，其实一般般的动画片。
1391249, 扑街。。。。还是扑街。。。。一直扑街下去。。
252342, 我其实没看完，但是看完寻龙诀我决定给这片半星
283358, 五毛特效。浪费我九块九！爆米花都买了18了。
515894, 我一爱喜剧的觉得还是看开心麻花的戏剧就够了～
731627, 吴亦凡的演技真的恶心透了，为什么不能打负分！
1061192, 女生之间除了抢男人，就没其它可拍了的？无聊！
601362, 真尼玛惊悚，看在舒淇很好看的份儿上给星= =
1396206, 一位已知天命的自命不凡的导演的不自量力之作。
251651, 影片如果在火车上的回忆结束也算有趣的电影了。
1396065, 尽一下绵薄之力  把场次让给更有诚意的电影吧
251621," 这种狗屎片子,我都懒得开骂了,谁拍谁一身污点"
118337, 不好意思 我要为我给这贡献的票房 向大家道歉
1396295, 景甜，景甜，景甜！！！1星，1星，1星！！！
1396321, 能不能不给星⭐？话说打满分的水军狗🐶也不少呢
1397495, 垃圾  我发誓这是最后一次去电影院看这种垃圾
1060737, 周冬雨演的真的不好，得奖让我对这个世界很困惑
284690, 负分！滚粗   跪求不要拍第二部！真的！！！
1397076, 去你妈逼，就冲着豆瓣被约谈，我就给你一颗星。
118495, 从远处对不起十二年，从近处对不起两张电影票。
515519, 平凡最好，人生难变。活着就好，哈哈，哈哈哈。
251852, 他他妈烂了！！！陆川你脑洞大开钱多的烧是么！
1394906, 我不喜欢，我是素质差的豆瓣网民，接受人民批评
251831, 里面那些冷笑话真冷。。。2016/04/24
251922, 一星，不打一星的真不知道你脑子里装的是什么屎
1394468, 应该起名叫饕餮。不过你确定饕餮是这个鬼吗？！
1395753, 哈哈哈哈哈哈哈哈哈哈哈哈哈哈哈哈笑死了什么鬼
1285567, life fucks me everyday
731791, 从此只欠星爷半张电影票，徐克欠我半张电影票了
1395972, 删除原评论。现在只想呵呵，有国煤撑腰了不起？
1395911, 全程瞌睡，不倫不類，景甜傻逼。德華情懷一分。
251780, 豆瓣分低，真的不是没理由的。剧本写的太糟糕。
97725, 人物和画面的美观弥补不了剧情的缺陷，有点失望
1395450, 张艺谋没搞奥运前都死了，打个一星能顶十个水军
516827, 尴尬的笑点，全片对女性的不尊重简直让人不能忍
281692, 剧情跳跃的离谱。。看的有点懵！  总之不喜欢
1854265, 从来没有感觉到一个电影能拍这……么……长……
281559, 。。。。。我读书少 别拿这种烂片来和鬼吹灯比
115926, 所以这片是讲的一群鱼要被海水淹死了？？？？？
116250, 什么时候中国人说话不护短了，中国动画就进步了
282037, 无法吐槽了，烂片中的典型，真佩服那些打5星的
282031, 为这个电影一个硬要夸这部电影的人我把她拉黑了
1065265, 卧槽，真的，真的，真的，真的，太他妈难看了！
253227, 您和原著不同也就忍了，侮辱观众智商算几个意思
523465, 这能叫电影？打一分是因为评论好的太诡异来拉低
1969867, 想来对日本动画电影无感！完全不理解好在哪儿！
115525, 被鱼粉的道家逼格吓坏了，特此一星心疼庄先生。
253673, 原著党真是日了狗了，你特么拍的是科幻片吧，操
194987, 看得睡着了，潜在为美帝霸权找口实……烂片一部
253708, 情节散乱，节奏缓慢，感觉像科教频道情景再现。
281269, 全片不止说一，剧情散乱，人物模糊，一分给特效
281262, 剧情什么鬼，演的什么鬼东西，台词处处都在装X
253648, 这个我也看了，居然也没mark，那我去干啥了
1382453, 太难看了简直不能忍！在电影院吐槽还不让说话！
1382072, 刚在电影院里看过，单薄的剧情，实在是不好看。
525260, 爱的不够偏执，感情不够深邃，还是跳不出狗血。
733782, 适合3到10岁儿童观看，和大闹天竺一样的垃圾
733545, 可惜不能给0分，看到一半我都为这电影感到尴尬
733572, 真的不好看，剧情尴尬，演技捉急，全程笑不出来
596899, 从前。现在。过去。再不回。一星纯粹给卢冠延。
758413, 一分与五分齐驱并驾，我只想说，我是一个真人。
253595, 烂片，什么他么鬼外星人，去你大爷真特么难看。
253610, 这部真是没蛋，我都蛋疼，赵又廷的胡八一什么鬼
923329, 看了不到十分钟实在看不下去了 太他妈的傻逼了
253521, 故事混乱，线索杂乱无章，故作神秘的伪科幻片。
524485, 还很一般啊，豆瓣打分怎么会这么高，不太理解。
281357, 垃圾堆垃圾桶垃圾箱垃圾袋垃圾场垃圾车垃圾！！
252680, 你敢告诉我最后的coldplay是什么鬼东西
1388804, 天朝在拯救全人类史上领先世界5000年！！！
282725, 不想浪费口舌了，2015年很难超越的一部烂片
252612, 不管是不是鬼吹灯的粉丝，都是一部烂到渣的破片
1389002, 并没有看，但主页已有三个人被盗号并被打了高分
732816, 能给负分嘛？就算是去蹭空调我也嫌弃这背景音。
1389164, 真是，又是一部爵迹。整部片都在装b，太尴尬了
116904, 不解释  只要我的心是善良的，对错是你们的事
282636, 感觉整部片子最精彩的就是叫兽易小星的歌唱表演
1968677, 一星……不能再多了，而且这一星是给配曲的……
58658, 哎呦，后面还有彩蛋啊，没看到，不喜欢，好无聊
252736, 为什么陆川这种三观不正的人可以一直有电影拍？
1736289, 一般，刷一星是为了那些说甩中国电影十条街的人
1388479, 没看过，为了对冲行政干预，做了一点微小的贡献
759123, 看什么鬼首映，才迎来新年2个小时就踏马的瞎了
283016, 这是唯一一部看到一半退场的电影。就不多评论了
283007, 我只想说到一半左右的时候观众们开始陆续退场了
1389674, 烂片  烂片  烂片  烂片  烂片  烂片
1389670, 用稀泥胡成的独立日2、魔戒以及变形金刚一锅炖
283085, 感觉应该很烂，早早降低了期待，不曾想这么烂。
520513, 三观太歪。一个人吃屎吃得再优雅，也不值得追捧
282218, 论陆川是如何将一部万众期待的小说拍成渣渣的。
1386830, 对中国电影报等恶意干涉大众影评的官僚媒体说不
1386919, 我不是针对谁，我只想说在座的各位都是——垃圾
733043, 实在笑不出来，坐在电影院尴尬至极、如坐针毡！
1387106, 烂片，尴尬的就像青花瓷里装着一坨屎。负分滚。
1386981, 其实就没看也不可能去看，纯粹是为了打个一星。
282271, 烂的程度与富春山居图比肩，堪称年度日狗神作。
282249, 这不是鬼吹灯，十足的大烂片，除了特效一无是处
1289974, 黄渤和夏雨还有陈坤的角色都很烦人，很想扇死。
116576, 你对我像哥哥一样好，看到这全电影院的人都笑了
1386625, 没看过，但是想说，若批评不自由，则赞美无意义
116344, 各种抄袭，各种炒作卖情怀，各种踩大圣，要脸吗
1386249, 翻出多年未登陆过的账号，就为了给出这一颗星。
1386195, 广电局垃圾贱货马屁精。一星给景甜爸爸景中宣。
116331, 请告诉我，这个故事除了美术效果为何拍那么多年
844526, 我的天，这么俗套的剧情竟然被吹上天，也是醉了
1386465, 如果把张涵予和景甜的戏份换一换，能再加两分。
282138, 不拍原著就请不要用原著来宣传，这样做太缺德了
282119, 就是借用了鬼吹灯的名头拍了一部不知所谓的电影
282108, 什么鬼…变成了军人打怪兽的剧情而且怪兽真丑…
1386451, 这是唯一一部没看过，就想给一分的电影！！！！
282552, 浪费了我2小时，导演编剧你赔得起我的生命吗？
1387935, 是不是以为你不提盗号刷分的事儿就没人记得了？
521806, 就像电影院的工作人员说的“这是一个二五电影”
1387296, 张艺谋，这狗奴才舔着舔着，慢慢智商也变成狗。
1854578, 如果没有特效和伊利舒化奶，我连这一星都不给！
1387289, 马特·达蒙一世英明，搞成晚节不保的样子了……
252869, 因为鬼吹灯去看的，嗯，以后还是安静看书就好！
1387464, 张艺谋最烂的一部电影是哪部？永远是下一部!!
1279400, 0.5分给特效，0.5分给AB睁眼的那一瞬间
250047, 年度最烂，没有之一。真是浪费了那些大牌出境。
1408316, 不知道花了多少精力把呆萌请来和智障拍智障片。
250051, 不能打半星吗？for 我自己坚持了110分钟
841854, 129分钟的电影我只看了69分钟就说明了一切
250196, 看得出陆川尽力了，可惜阳痿的力量不能让我高潮
1407638, 独立的对一部电影的评论是豆瓣最值得坚持的精神
605330, 弱智无极限，星爷也开始粗制滥造了，三观尽毁啊
250127, 《寻枪》《可可西里》是不是把你的才华耗尽了。
1409185, 上一次看这么糟糕的电影还是在《恶棍天使》时。
1409584, 还是没有逃脱“景甜定律”阿，可惜了马特达蒙。
1409540, great wall ? It sucks!
1056300, 两个女主都丑 男主也丑 男主还不如我初恋好看
1408994, 不会去看，我就是上来打个一星的。咬我啊凸 凸
1408609, 真的 看得我尴尬症犯的不行了 啥几把价值观？
507133, 纯搞笑，无内核，剧情粗糙无比，看起来很受罪。
1408727, 如果不能零星那这一星给特效饕餮，怪吓人的（。
249942, 即使脱离原著，独立来看也是一坨莫名其妙的东西
120157, 一分给国产动画，吹得太好，结果看了觉得好失望
1405880, 长城，贾跃亭最后的狂欢，乐视最后的坟墓。。。
509409, 不管是白月光还是蚊子血，这屌丝永远都配不上。
1405800, 本来是2星，听说不让打差评，特地回来改了一星
761928, 实在是不知道点在哪，我觉得现在的评分过高了。
1406453, 整部片子只看出了中国人智商掉线，武力低下 。
1961732, 除了唯美的画面，我真不知道这部电影哪里好看。
605024, 陈年老哽弱智版色戒，负分滚粗。不过我爱黄渤。
120363, 给一分因为是国漫   吐槽一下水军也是够多的
1407249, 为了激励中国电影事业，我来贡献我的一星！！！
120376, 故事！你TM好好讲故事行不行，什么jb玩意。
1729405, 我能说烂成狗吗，无聊，这片子居然还8分以上？
120215, 看在粉丝 怒骂那些打差评的份上就活该打个一星
120189, 两个红衣小孩相互续命，连累一位长者无法加一。
120234, 我只冲着好电影去，跟爱不爱国无关，一颗星吧。
842051, 不错，但是8.5分有点过誉了吧，为此，一星。
1405554, 如果豆瓣死了，从此我绝对不再进电影院去看电影
1412210, 还能说什么，贡献微薄之力，表达人民群众的心声
249479, 九层妖塔毁了我大梦龙的demons   呸！
121337, 海豚不是鱼，跟大鱼有什么关系，应该叫哺乳海棠
1727747, 立意肤浅。分数虚高，打个一星平衡下，3.5分
1412028, 没有别的，就是为了挺豆瓣贬人民日报来打一星的
287892, 请问里面讲的什么内容，我睡了一个半小时没看到
729190, 剧情神经，吴亦凡毫无演技，与降魔篇交集过多。
1412434, 张艺谋是想证明给我再烂的演员我也能拍成大片。
249562, 怎么做到每个演员都做作到恶心的，导演功力好棒
249568, 陆川导演大概是魔兽世界玩多了，脑子都开挂了！
1411886, 为什么我只迟到了15分钟，就应该直接错过全场
606734, 抱着猎奇的心态大致烤完了……没什么意思啊……
1276734, 抱歉 可能是我没看过原著 连槽点我都找不出来
249312, 赵又廷丑得超过我的承受极限，岳小凤都救不回来
249352, 终于熬到结尾，刚要松口气，却响起一首英文歌。
249289, 真是差 姚晨的角色明明写得是Maggie Q
1412488, 一分都嫌多！浪费我的票钱 50块我干啥不好！
1412679, 滅掉中國電影的不是影評，而是爛片，支持豆瓣！
1412526, 难道是因为景甜演了长城所以要威胁我们打高分？
1856684, 不好看，香港的场景非常假，车辆竟然是左肽的！
1412895, 景甜到底什么来头？凭什么刘德华死了她都没死？
1412833, 纵有人民日报为它洗地，但是烂泥永远扶不上墙。
1410044, 垃圾，不多说第三字，就为了央美发的声讨内容。
1409641, 不好意思，《长城》你躺枪了，黑豆瓣，不开心。
249856, 除非为了钱，实在想象不到这种东西存在的意义。
249810, 侏罗纪昆仑山&胡八一之金刚狼&知青与外星人。
1728186, 假棒拍丧尸就是个笑话，打五星的都是水军么TT
1411101, 一颗星给用火药去炸火药房竟然每死的两个外邦人
121194, 都不知道这部电影要表达的是什么主题，无法理解
1960319, 实在没有感觉...连个电影感觉都算不上...
287685, 不好看太失望😞太失望，真是期望越大，失望越大
1410823, 没去，电影院看过，但是鄙视老谋和谋报社电视台
249708, 不会讲故事，不会用音乐，滥用电脑特效的好典型
1400462, 张艺谋现在什么情况，拍的一部比一部烂....
1400411, 这一分留给达蒙和在权力游戏被爆头的那位汉子 
1399996, 这片子，拿不了奥斯卡，就是西方针对中国的阴谋
1400202, 还好张涵予死旳早 老谋子估计也要晚节不保了 
118994, 吐了，今年第二次吐了，上一次是看三打白骨精吧
119239, 备胎为了帮助女神和男神在一起牺牲自己的狗血剧
1401308, 看到景甜在海报中间，我就放心了。什么玩意儿！
730947, 一星都不配，烂片，烂到家，吴亦凡的演技我呵呵
1401585, 投资方是屈服于xx的压力么？有钱也不能乱花啊
119294, 画面不错，剧情……在微博吐槽好多次了，不说了
251008, 要不是我妈不看外国片。电脑里就找到这个。。。
1400804, 差评不是饮鸩止渴，对烂片的纵容才是饮鸩止渴。
760980, 看到这个演员的阵容，我就知道，它一定是部烂片
1398445, 一星给饕餮，幸好电影票不用钱不然还要心疼钱。
1398321, 你取个更像歌舞晚会的名字的话我肯定不会去看的
118780, 彻彻底底女主三观有问题，一分给的是张春的美。
251325, 月月跟高晓松跑了...谁带我跑...出电影院
515033, 违背了自己的誓言，又看垃圾片，不，又看国产片
1397812, 叫了个意义深远的一个名字拍了个内容浮世的片子
251366, 电影频道免费播都看不下去，大过年的，太可怕了
285073, 打生化一般都用60，AK47子弹太少不好用。
1399673, 只为了防止水军，当然这电影也差不多就值一星。
1399573, 呵呵呵，每年都需要有一个烂片让自己冷静一下。
1399526, 看了这么部屎片真是醉了，呆萌你有点下限可以吗
285120, 看完失望透顶，不知所云，情节浅尝辄止！失望！
514175, 一个LOSER的男人和一个非常傻的女人的故事
1398817, 除了一堆明星 简直烂爆了 忘了是张艺谋拍的了
118833, 我救你你救我他就我全世界都爱我的青春疼痛文学
193075, 不好意思，电影4星，某些垃圾黑子让我觉得恶心
1404215, 中国人以一敌亿，外国人加入中国军队，以一敌亿
1404431, 开场10分钟，看到景甜那张脸我心里就咯噔一下
250668, 一直有看奥特曼的错觉，却有没看见奥特曼的失落
1403951, 总要有一个女的活下来，那为什么不能是景甜呢？
1405293, 光腚越来越不要脸了，就特么给一星了，怎么着吧
1405028, 本人表示不会去看，扔进垃圾桶，一分都觉得多！
1730131, 充其量给一星半。这么烂，，，你们眼睛都瞎了么
1402570, 看奥运会开幕式火炬手小甜甜如何点亮圣火打怪兽
1402564, 一星给特效 还有给景甜配戏的所有明星辛苦了。
603267, 一星给舒淇，剩下的角色没有一个人样，看着恶心
1731023, 看了流感，摩天楼之后，觉得还是给一醒比较合适
1402172, 一分給砸下去的錢..不中不西 不倫不類的感覺
1402056, 讨厌恶心下流呸，给长城打3星以上的都是傻逼。
1401996, 看了批评豆瓣恶评的新闻，抓紧来评个分，压压惊
511161, 喜剧的反面是尴尬......（一切尽在一剪梅
1403500, 张艺谋拍的烂片，跟别人拍的烂片，并没什么区别
1403172, 听说日人民报不让打低分，我就来打个1分压压惊
250774, 九层塔超越太平轮成为我今年看过最傻逼的大烂片
119528, 太难看了……跳了十几年，就这一结果，也是醉了
1402788, 太烂，槽点无数，转接各种生硬，特效也很一般。
250784, 烂片爱好者都表示只能给一颗星 不能再多了！！
511619, 看到一半就出来了，情节很生硬，我也觉得不好笑
511640, 第一次遗憾不能打零分。九层妖塔好歹还是电影。
46855, 比复仇一差了多少个等级，3D效果简直没底线了
1484082, 只听声音不看画面我都感受得到那种没演技的尴尬
428116, 啥也不想说了 开始就没想去看 实在是没得看了
428119, 这部片子把我对何炅十几年来的好印象一下耗尽了
1529181, 讲一个故事有一百种方法 周星驰非用最烂的一种
428028, 两星已经很给面子了，国产敢不敢不拍青春片了？
428061, 灯光 剧本 摄像 演技还有人设都像狗屎一样呢
1218497, 什么玩意儿别毁我que sera sera！
1598523, 看完了就雷到我了，这剧情和没有剧情一样。。。
428284, 什么鬼呀天哪！！！看了前几分钟我就想走人了。
1654711, 没看懂再说什么。。怎么会有给3星以上的人。。
1683202, 扭曲的人生观价值观世界观，畸形的爱情友情亲情
1598398, 我的个天啊，真是很久没有看过这么差的片子了！
1654764, 莫名其妙的电影，表演矫揉造作，剧情逻辑混乱。
1598464, 我为什么要浪费生命去看！我为什么要放弃治疗！
428223, 为了何老师和峰峰打的一分 一出搞笑芭蕾歌舞剧
1682953, 我已经开始怀疑小四是不是故意拍的这么烂= =
427814, 看了基几花开我决定给小时代多加一星.....
1598108, 我只记得那些个特写镜头吖，和多次出现的H毯子
1683096, 可能是因为前两部没看过 然后没看懂 反正好烂
817708, 剧情很一般，除了最后的点睛之笔。音乐很一般。
1683053, 好久没有在电影院吐槽吐得那么爽了。。。。。。
1683023, 放歌放歌放歌放歌撕逼撕逼撕逼放歌放歌破罐破摔
958765, 跟我姐去看的，相当增进了我俩革命同志般的友谊
427956, 最怕这种人说出“从此爱上导演这一行”一类的话
