,comment
210604, 就...成龙的电影嘛
2037168, 俏姐 凯丹 中文版🙄
351915, 一般吧，为了支持国产
1147139, 我怎么觉得不怎么好。
798381, 对不起，我中途睡着了
1843249, 消遣都觉得有点鸡肋…
974420, 这就是个虐狗片儿嘛！
735391, 剧情混乱+糟糕的台词
1864022, 觉得给三星都算多了。
860793, 后继有人的中国喜剧〜
1863999, 都是凤阳阳养的毛病。
588092, 中规中矩的平庸之作。
1101858, 浩克好萌。。哈哈哈哈
611239, 也挺好看，视觉别扭。
1341995, 相比九层妖塔还是好些
1621182, 其实我觉得也没那么差
86721, well······
646892, 我讨厌最后的和谐社会
974399, 革命英雄主义巨制？？
1864078, 陪儿子看的，没啥意思
1621213, 没有想象中那么糟糕啦
1621237, 比想象中好不少。。。
1621176, 你们咋了 有那么烂吗
218062, 怎么还有成俊哥= =
1342011, ab睁眼把我吓一跳。
1863899, 我在电影院看睡了竟然
1826697, 变形的时候还是很帅的
916921, 看完笑过没什么记忆点
1826704, 爆米花片，也就看看，
1141992, 这片也有8分也是醉了
1101805, 没有宣传的好，减一星
1504738, 感觉没有书好 很一般
86606, 啥跟啥 女主的心太大
218067, 剧情确实烂，动作还行
186081, 其实一般。有奥特曼！
1504889, 就两次车祸给了我震撼
588144, （使用豆瓣电影之前）
86864, 国漫本土气息表露无疑
1101980, 放松大脑轻松科幻片。
903749, 小陶虹竟然客串了一下
1505103, 一般，剧情跳动比较大
974210, 哮天犬该给个最佳男配
1620972, 我觉得很可乐啊哈哈哈
903732, 期望太高，没有笑到爆
1826422, 这就是给中国人拍的吧
1088051, 唐尼在，還有些看點。
1653878, 女孩子间的友谊，很好
1864325, 没啥新意，就一直打。
808274, 3.5，结尾很心酸。
1088060, 还是绿巨人最搞笑……
1505114, 凑合 对青春片免疫了
580910, 科学技术是第一生产力
1826455, 真是太特么长了。。。
1203945, 也许经历不够，没看懂
86787, 你对我就像哥哥一样好
1826529, 擎天柱很有人格魅力诶
1270362, 看了首映 其实很一般
1826532, 剪辑奇烂 真的 奇烂
1864147, 有些广告植入的好突兀
1864143, 不错的，场面一如既往
59336, 点评我就服暴走大事件
1621158, 电影版偶像剧第一集。
218146, 不差，但是也就那样~
466895, 虽然老梗。但挺有笑点
974273, 彭于晏女友那段太失败
1505013, 一般，不喜欢这个故事
528512, 一般 没宣传的那么好
646883, 就感觉舒淇变漂亮了耶
974305, 整部電影都好痛...
1864185, 重启故事线感觉无厘头
1193878, 情节感觉并不是很深刻
1504968, 感觉处于青春片中上游
1864352, 没有期待中的那么好，
1653590, 看了一遍小说  懂了
1826860, just so so
588032, 土豪男的奢靡生活写照
646912, 及格水平，有点重口。
86262, 食之无味，弃之可惜。
1101633, 一锅大杂烩= 。 =
1504290, 嗯…南航校花蛮好看的
365582, 还行 只是剧情太单薄
86332, 金玉其外 败絮其中 
1621592, 没有想象中的那么差。
1621596, 最后的合唱比较好看吧
1621609, 陈学冬！！！！>_<
611313, 星星全是打给我女神的
1826855, G点来多了，容易麻。
86304, 天之有常，逆天而行。
1204016, 看完觉得挺没劲的反正
186468, 天朝的赞助真有意思。
735588, 非常喜欢王丽坤的演技
86226, 并不能打动我，以上。
340679, 不觉得这个可以得8+
1863572, 真是坑，一点意思木有
1350114, 效果很好。剧情较烂。
974837, 没有废话，喜欢狗狗。
1204014, 浓浓的处女男气息……
186448, 噫，这一堆人在干嘛？
1101691, = =表示不了解历史
217991, 成龙的片子也就这样了
445697, 想法可以，电影一般吧
2016337, 狐狸的性格像钢铁侠。
1101742, 也就那样。特效好看么
974645, 全是高潮等于没有高潮
186162, 剧情一般，一般，一般
186168, 吧唧哥哥帅哭，站炖冬
186174, 闲得无聊那就干一架呗
1863857, 奔着植入广告去的==
1302827, 华语科幻电影特效之巅
86488, 给原创的勇气一点鼓励
217981, 权相宇有点帅帅的样子
186262, 五个逗比打五个逗比。
86386, 故事两星，奇观四星。
217961, 和赵世庆去看的。。。
86353, 三星给美术。三观不正
466752, 一直笑 笑完就忘记了
1863734, 一部更比一部烂= =
1863783, 不如以前的好看哭哭嗷
2016427, 为何我没有什么感觉？
59481, 下好了，不想看，删了
795406, 高司令一开口好尴尬呀
1473697, 这是80后的青春吗？
86419, （新城市广场SFC）
2053896, 还好吧 咋这么高评分
1621518, 画面很精致。唔。。。
1826406, 。。。。。。。。。。
87442, 画面还是很美的。。。
87436, 除了剧情，其他都还好
467140, 中年男卢瑟恶心的梦想
735073, “不喜欢就不叼咯。”
917491, 2013.01.08
185130, 只能说我对大片不感冒
340127, 盛名之下，也不过还行
2015033, 值得一看，看完就忘…
340130, 剧情太短，像个预告片
340138, 孙猴子大战毛毛虫……
808483, 还行吧，女主很好看～
218503, 有教育意义的好电影。
467101, 常常以为自己在看小品
1864849, 不好看！不如三好看！
546346, 实力喜剧，笑笑就好。
588268, 有托尼的电影是必看的
611044, 喜剧恐怖奇幻大片……
444986, 跟姐姐妹妹比高看的？
1864896, 打斗场面看的头晕眼花
973766, 一直充血，会坏死的。
1865194, 三个多小时无聊的打斗
340070, 希望越大，失望越大。
1620103, 一边看一边吐槽好欢乐
2054661, 公务员的办公状态……
1620109, 片尾精彩度超过正片！
2014819, 就我看睡着了么。。。
1865127, 跟LL看的第一部电影
87677, 论一个备胎的自我修养
444765, 何老师还是好好主持吧
1865227, 三分都是给3D效果的
1506060, 不怎么样 幼稚的青春
617540, 新的悟空形象，很好。
1620083, 看着养眼，剧情太渣。
1302624, 8分太高，7分管够…
87597, 三分献给画面和配乐。
1473205, 陈都灵的小耳朵还不错
1826047, 2014的最后一次。
185084, 搞笑有余，心塞也足。
185090, 有那么点心疼钢铁侠。
546314, 劇情可以，三觀不對。
735051, 特效可以，剧情欠佳。
2014926, 只能说不能太高期待。
87596, 画面很美，剧情很糟！
87593, 祝融和赤松子真是帅啊
218616, 3D不3D 有差别吗
1223080, 你已离去，后会无期！
671817, 徐克的特效是真的可以
917535, 觉得没有人在囧途好笑
1826167, 节奏、叙事、逻辑差评
611131, 猪八戒吓死我了。。。
445260, 淡淡的青春，纯纯的爱
1102116, 就是用来娱乐放松的。
1864540, 比起前三部实在太差了
1864524," 廣告真多,坐到PP痛"
1505401, 一个由婊子引发的血案
59204, 论一个千年备胎的修成
1154028, 台词经典，剧情弱智。
974056, 其实真的经不住推敲啊
1376962, 好看，但感觉不过瘾。
1826334, 冰冰姐会三门语言！！
185494, 敌人的敌人 是朋友 
185598, 请问高潮部分是哪里！
1505249, 一般般，没有原作好看
1864388, 打酱油的人和物太多了
917176, 我老婆说还不如1搞笑
185673, 还是更喜欢钢铁侠！ 
466953, 搞笑的~ 脑残神剧~
445340, 淡淡的青春 纯纯的爱
1620799, 高架上狂奔是哭点！！
185611, 烂剧情挡不住颜值高啊
580898, 漫威世界补习起来 !
340352, 作为国产剧还可以了。
1620842, 电影比小说好，系列1
735266, 算不上烂  但也不好
87235, 后面送鱼走太磨磨唧唧
860894, 笑过之后很空虚的感觉
1864764, 广告出现时就是笑点啊
523713, 真的看哭了居然。。。
917344, 各种无厘头式的搞笑。
646862, 我当你是恐怖片。。。
662435, 三观不正阿看完的感觉
1864715, 变变变，学个驾照先！
995607, 节奏贼怪主角光环贼亮
1826180, 珠海电影院。mark
995584, 彭于晏身手不要太矫捷
1087975, 嗯，没有黑衣人逗……
1826277, 无论哪方都很莫名其妙
1864637, 纯看效果看场面，没劲
611107, 没人被吓到吗。。。。
995533, 挺帅的 但是没燃到我
917268, just so so
366301, 剧情太牵强，画面还好
662431, 一万年太久 只争朝夕
903675, 还行 没有第一部搞笑
1473359, 欧豪演了一个人生赢家
1827417, 霸天虎是打酱油的么？
617322, 2013-10-01
916129, 结尾不喜欢。其他还好
975871, 妥妥的公安干警宣传片
635314, 蛮好笑的，配角哈哈哈
1153560, 跟他的小说一样，散。
84931, 没那么烂，也没那么好
187780, 没有复仇者联盟2好看
1303064, 陈坤真是让我刮目相看
1862358, 每一次都是这样，呵呵
1349777, 比九层妖塔要好一点。
84968, 给画面和配乐，还有湫
1827412, 不爽的是 内对狗男女
217409, 成龙大哥讲了三个故事
1653014, 除了演员颜不错。。。
1827473, 花了两个半小时看广告
1190456, 这种片只适合在b站看
84853, 所谓情怀，不过如此。
860563, 哪有说的那么好看？？
1502677, 甜言蜜语说给左耳听。
1502666, 还行，没差的那么夸张
975889, 林超贤看来要当御用了
217463, 凤娇姐算是彩蛋么~~
523873, 就是周末笑一笑的电影
735893, 果然期望低就觉得还好
1153623, 韩寒毕竟是个文艺青年
1827310, 看到睡着，BGM不错
660242, 根本就是吓小孩的货。
1233687, 感觉像是在看段子合集
2053392, 细节加分，技术加分~
1862556, 额(⊙o⊙)…父女情
1503071, 你走过的路 我都走过
975721, 感觉没有吹的那么好看
1862541, 一是雾霾，二是广告。
916205, 我觉得没有第一部好看
1502824, 电影永远不如小说好！
1377534, 一般~剧情并不吸引人
466408, 这故事也太TM弱了。
637608, 有的片段還是超搞笑的
1653099, 三星给顾氏夫妇和崇光
1623039, 巨大绝望中的小小努力
187675, 豪华阵容版的撕逼大战
1236288, 有重复之嫌~~公路片
2018236, 太顺利了的圆满结局。
1142389, 爆米花电影，，，，，
1349664, 猜到了开头猜到了结局
1153454, 有了气味，缺点味道。
976111, 河水有点漫出来了……
1190469, boring呐。。。
84509, 台词好傻。。废话好多
217306, 唉我都不知道说啥好。
1342164, 夏雨是亮点，特效不错
860524, 黄渤戏份忒少了。。。
1827575, 能换个编剧么。。。。
2018996, 卡通&剧场版陀枪师姐
1861972, 什么乱起八糟的...
915964, 爆米花片来讲算合格吧
1474394, 还是小说有幻想的空间
736095, 天马行空，脑洞大开。
1861788, 除了变形金刚豪无亮点
1861731, 挺震撼的 和男友看的
466223, 前半4星，后半2星。
915884, 比不上第一部，被吹捧
363954, 跟风看的，画面还不错
84399, 白瞎了这么多好人设。
976255, 地一定要往烂里洗吗！
1342181, 减两星只因我爱白月光
1861904, 梦龙的主题曲好听到哭
188283, 感觉一般般。。。。。
1861900, 除了场面还剩下什么？
546924, 笑点多，但属于小品式
703250, 剧情有点。。。jpg
1142567, 对好莱坞大片欣赏无能
1502179, 甜言蜜语说给左耳听。
364014, 我果然长大了👏🏻👏🏻
703290, 还好啊，并不觉得难看
1862024, 广告看着真难受。。。
1193547, 其实看不懂，逼格太高
617299, 舞跳的不错 一笑而过
1153487, 一般般，好坏参半吧。
1862119, 难以认可 G1赛高！
60032, 鱼之大，不知6分可否
217368, 剧本就像是70年代的
916060, 咋个看到后面会很感动
84837, 就………好尴尬啊呵呵
1862251, 很一般，给小孩子看的
807444, 并没有推荐的那么好看
84831, 三颗星全给画面和配乐
587708, 标准商业片，但看得值
217312, 反正我笑了哈哈哈哈哈
1862072, 李冰冰戏份居然还不错
1502435, 还可以，至少没有堕胎
84655, 没那么好，也没那么糟
1142519, 爆米花电影谁说不好呢
669970, 故事凑合，特效不错。
1308751, 挺不错的，陈坤好帅！
1308754, 比起九层妖塔简直良心
975694, 本质上是香港警匪片。
217545, 成龙迷不看的好~~~
1473896, 青春若有张不老的脸。
744837, 比起上一部的差多了吧
1193720, 顺顺的手语真是碉堡了
975197, 枪战片评分竟然这么高
217763, 权大叔像是打酱油去了
1101395, 大概90分钟就好了！
85894, 剧情单薄 有的很拖沓
1863292, 只记住了各种植入广告
1622104, 看完2勉强补上→_→
1503899, 不咋地，完全没有入戏
1863291, 特技很好，情节还凑合
1302902, 胡八一，一朵花的幻觉
1222972, 喜欢是放肆，爱是克制
1863306, 就是任性，就是看大片
2017392, 只有树懒好笑。。。。
85718, 为了雨神和火神给三星
85713, 爱是奉献而不是索取。
85712, 畫風可以，劇情一般。
581029, 为了看2我先补了1！
916502, 适当时间的讨巧电影。
186950, 及格之作，看得挺过瘾
975278, 根本看不进去啊...
85695, 给画面和金世杰的配音
340818, 各种妖怪总感觉欧美化
1863154, 没有马克我是不会看的
546655, 有个爱你的人不容易～
807804, 一个小时后才找到感觉
85807, 画面不错。剧情太差。
340802, 一下治好了我的抑郁。
1863168, 好一部逗比的广告巨制
186920, 希望越大，失望越大。
1863315, 看过的最长的广告大片
1504064, 演技不行，剧情还可以
1653450, 杨幂的声儿老让我跳戏
1142106, 对美国英雄主义免疫了
617399, 我不喜欢这个演员阵容
1088210, 地球又被拯救了，偶也
580999, 休闲娱乐来一个。。。
1473810, 又是一记渣男作女猛药
86118, 怎么有这么恶心的女人
611360, 沙悟净怎么那个恐怖啊
1350090, 有中国夺宝奇兵的味道
611364, 怨气如此之重，周星驰
1826946, 容我喝口舒化奶压压惊
795453, 光看衬衫西服大跑车了
1827005, 食之无味，弃之可惜。
186664, 续集，故事越来越扯了
2017086, 雅痞狐尼克改变世界！
85942, 祝融和松子的迷之CP
975049, 看了前一秒知道后一秒
974946, 到底tm好看在哪里了
340750, 还可以 但没那么神吧
611387, 看电影要看和谁一起^
916648, 反正无聊还是可以看看
86000, 我不喜欢女主，仅此。
735627, 特效挺不错，故事杂乱
611398, 这居然是一部恐怖片。
186961, 情怀吧 爱漫威不解释
1349990, 不错的鬼吹灯改编电影
975546, 还好没去电影院看……
1827230, 植入广告伤不起~~·
364838, 剧情实在没有可评之处
1474086, 觉得挺好看哒（逃跑💨
916336, 按摩这段还是蛮搞笑的
703539, 吴亦凡的演技令人尴尬
1302979, 汽车电影院上看的好累
1503356, 一直在回想小说的情节
1862838, 没有剧情，光看特效了
85461, 全靠美工的狗血故事。
975540, 林超贤大概等于柳承莞
1862761, 看这系列似乎成了喜欢
850375, 2星剧情，5星歌舞。
669907, 吴亦凡没有台词该多好
1862633, 好一个李冰冰-  -
975654, 老婆说，景色还不错。
1153642, 看得还是挺有感触的。
85265, 只有中国元素让人欣慰
1622832, 一点点对于青春的感慨
1862760, 啧 拖了一年还是看了
975597, 很多难以想象的事情。
1474103, 为了演员。。我忍。。
1503227, 剧情不错，就是没共鸣
59854, 赤裸裸的备胎启示录。
1862700, 剧情简直看不下...
807612, 可能这种艺术我不懂吧
1622817, 完全是看帅哥美女的。
860629, 王宝强真是太戆了……
1142223, 对超级英雄疲劳了……
85635, 编剧你特么是逗我呢么
365002, 飞一样的感觉吓到我了
85623, 期待很大。着实一般。
59734, 美则美矣，不明其妙。
1142232, 还可以，就是有点乱…
1101274, 是怎么到了8.1星的
975409, 最佳配角--哮天！！
1622357, 纯粹是被宣传吸引的！
1473967, 居然没有想象中的差！
85666, 故事情节十分单薄，哎
1153746, 由无数段子组成的电影
975341, 电影意义大于电影本身
2017561, 没有超过大白…一般吧
1101241, 还不错的英雄题材电影
916388, 也没听说的那么好看啊
649235, 不让别人知道这次收藏
1622487, 故事情节还是太零碎了
1622492, 少女的梦是可以做的。
1302955, 可故事真的很乏味呀😄
860681, 也许是我笑点太高了？
617368, 舒淇演技还是蛮不错的
1827115, 请还我牛逼闪闪女主角
446363, 一般般，看何老师面子
646954, 过于暴力了，少儿不宜
1827112, 啊  内容已经忘却了
1233779, 没有想象当中的好看。
1865243, 太多国产广告元素了吧
89647, 除了画面精良没别的了
1472122, 2015-05-01
1271311, 段子，金句，好像杂文
89627, 单说情感够，缺情怀！
1617597, 颜值撑剧，看脸时代。
610507, 这算是最中庸的评分了
704775, 不如1，还是舒淇漂亮
1194242, 老实说3星 不能再多
1617518, 很是失望 不多说 唉
646677, 除了那熟悉的旋律之外
2055954, 耷拉着的死鱼眼好萌哒
734223, 还是第一部演的比较好
58107, 我可以说看不下去吗！
1203645, 其实一般，虽然喜欢。
1617682, 凤小岳黑转粉。。。。
694633, 很多台词嘴型都对不上
861258, 真心觉得一般啊！！！
182821, 非常无语，怜爱铁罐。
588780, 爆米花片，略带喜剧。
1867656, 特效体验片，仅此而已
1617599, 追的不是电影 是青春
1154784, 第一次拍已经不错了。
809467, 音乐很好听，结局可以
1194237, 为我锤锤和孔女神点赞
638038, 好坑爹，什么鬼剧情。
2011909, 着实……一般…………
1103506, 随便看看的，娱乐一下
467992, 一部完全男性向的电影
58024, 和闺蜜看的，她哭了。
2011729, 期待值过高，结果……
1508688, 其实没有想的那么差啦
704834, 期望越小，失望越小。
1824752, 前半四星，后半两星。
2011740, 和谐社会遍布各个角落
182434, 看到后面已经没耐心了
368861, 孙悟空就是个大傲娇！
1233219, ？？？？？毛线玩意儿
1219923, 2014.8.20。
89914, 讨厌椿  (ㅍ_ㅍ)
1868110, 还行吧，广告太恐怖～
58003, 声画顶级，剧本弱智。
89835, 化作人间的风雨陪着你
89752, 故事略苍白，配乐好听
1203618, 太大期待，沦为一般。
809527, 期望过高，没被打动。
1206942, 千里之行，后会无期。
1617492, 三分打给女神=_=。
1617493, 矫情啊！好懂顾里！！
1472049, 至少故事算是讲清楚了
1867978, 爆米花电影，还想怎样
1351299, 视觉效果可以给高分！
1376288, 这次特效不是五毛钱!
182844, 一部普通的美国科幻片
1508610, 有些喜欢还是太早了～
1103561, 一般，钢铁侠帅到了~
694600, 这次演杂了，也玩杂了
704647, 还凑合啦！嘴角含春。
1867306, 不喜欢就滚，人云亦云
1867305, 中国广告给了多少钱？
1154704, 情节太弱，笑点太段子
2012602, 9.4分？在开玩笑吗
918374, 看脑型，土豆蘑菇组合
918358, 嗯。笑过就好 = =
1103298, 笑点颇多，但是不燃啊
219446, 标准成龙早期港片风格
1617974, 偶绝对还年轻！！！！
89299, 三颗星全部给画面和湫
704655, 看下来是部gay片。
219473, 2012-12-22
219461, 只是因为十二生肖而已
1351170, 最后都会来个科学解析
996187, 远离毒品，珍爱生命。
89171, 画面的精致程度没话说
1194188, 云里雾里 没看大明白
861209, 居然敢黑我大葱油饼！
1223251, 真的是看了影评才看懂
1618093, 就当mv看好了。。。
467786, Summer不烦恼！
1472324, 多的一星给那个巴巴啦
1867285, 感官享受，惊现处女座
467780, 段子不错，三观有点歪
610612, 有过牵挂，了无牵挂。
1507836, 女人的爱情总是太感性
694674, 没有比较，没有伤害。
183169, 蜘蛛侠读书时是话痨？
1867334, that's OK.
918431, 不明白为什么曾经会火
694639, 特效不错，有周星驰味
694643, 爆米花撒了一地 喜剧
1867522, 相当无聊......
182924, 不要看剧情，看特效～
1617825, 电影院一群NC和花痴
918523, 结尾矫情出妊娠反应。
368415, just so so
368405, 猴子太丑了，只给三分
1472190, 我的青春可没这样深刻
1508153, 三星给女主和片尾曲。
1867561, 食之无肉，弃之有味。
1103391, 洛基很萌，绿巨人很萌
1472185, 我还是喜欢杨洋的长相
903312, 电影总离不开教育大众
1867552, 下次弄一广告集看看吧
588775, 好看，但也就好看而已
182888, 各种乱 还好有斯嘉丽
1617781, 片尾三分钟胜过全片！
704694, 猪八戒真是可爱到不行
734336, 又黄又爆  还有sm
1376405, 没有小说写的精彩..
861243, 好吧。。。笑笑更健康
58172, 告诉我们 没事不要作
1867368, 我可以说我看睡着了么
996227, 国产大片， 还行吧。
694651, 不喜欢里面太多港台腔
1472246, 是有故事修养的导演。
1867351, 太商业了，有点小失望
1472247, 都是不像青春的青春片
89329, 画面精美，情节没法看
848678, 还行但是没什么剧情。
971873, 水上快艇追逐战还不错
182994, 小蜘蛛和妮妮很萌啊~
368383, 三星半。没想象中好看
996519, 情节紧凑，政治正确。
2010877, 情节老套，萌点十足。
733909, 完全是因为特效还不错
733914, 剧情一般，特效不错！
181826, 2016.05.07
57806, 莫名其妙，食之无味。
1206977, 喜欢是放肆，爱是克制
848187, 很多吹捧都言过其实吧
705036, 特效和想象力太惊艳。
1868984," 你若安好,便是擎天!"
669516, 至少我得到了我想要的
1616623, 结尾的彩蛋比较有意思
1471639, 挺喜欢吧啦这个姑凉的
1471678, 好久没看这么文艺的了
1509549, 去影院看也算是支持了
1824443, diaozatian
1868763, 很他们吵的一部电影。
1616715, 介个。。。那个。。。
90370, 没有讲出一个好故事。
369265, 你们给的都是情怀分？
1868750, 不知道还会出多少部！
919086, 觉得一般。。没必须吹
1824450, 女主角是啥玩意儿？！
90384, 湫为什么可以这么惨？
970877, 狗狗才是人类的好友友
1868872, 看着睡觉，没有3好看
704997, 没记住讲什么的是什么
1509582, 俩女的说的都不是人话
1616691, 开头还可以，后面烂尾
90402, 哈哈哈 台词太好笑了
181846, 剧本比2的感觉弱一些
57821, 2016.10.16
1616697, 这是一个很挫的故事.
219953, 真心有人觉得值5星吗
1087190, 我看到伊利的植入广告
90485, 我觉得还不赖....
638143, 一万年太久，只争朝夕
220086, 据说，这是部搞笑片？
442388, 三颗星，单纯给何老师
1309307, 有些节奏太慢我受不了
1869132, 太长了，晃过来晃过去
1824310, 我一个人 看的 你呢
1351497, 陈坤和黄渤演技没得说
1351495, 2015.12.24
220123, 不让别人知道这次收藏
1616362, 冲着郭采洁给的3颗星
1824280, 我居然看到了穿帮镜头
181703, 好吧，美国的超级英雄
1104031, 在电影院里昏昏欲睡。
468212, 爱做梦的小青年最爱。
1869031, 我像个跳芭蕾的女胖子
610305, 孙悟空的造型太差了吧
1824315, 一个系列总是越拍越差
848158, 期望过高，真心一般般
1509484, 及格，其实没必要3d
1471920, 挺好的，有点小感动。
1509137, 6分儿不能再多...
1471923, 小耳朵的演技真捉急啊
1140928, 1分给特效2分给洛基
1509125, 中规中矩的商业贺岁片
339132, 没惊喜 超不过宝莲灯
219828, 依然卖力的成龙大哥！
1471902, 青春记忆啊 还算还原
1203588, 马达加斯加犬太萌了！
971150, 套路作品，选址有新意
90149, 歌挺好，画面挺好……
369022, 三星里有一星是鼓励。
903243, 笑点变高了是好事。。
1509080, 纯爱片。。。心累。。
90015, 剧情对不起世界观系列
1868219, 女主又没看头又没啥用
90008, 剧情短板，效果还不错
2011526, 并没有说得那么好看啊
1471979, 没有评论得辣么差啦！
1868227, 还可以由 必须支持啊
339150, 期望国产动画越来越好
971265, 2016.12.20
2011459, 新瓶装老酒，瓶子蛮靓
1087286, 很多剧情感觉生搬硬凑
57865, 设定还行，剧情破碎。
1868656, 怎韩庚一句我靠了得。
1376149, 是寻龙诀 不是鬼吹灯
919042, 【3.5】泰国传奇。
181965, 😂自己人跟自己人斗…
1376112, 黄渤撑起了整部电影 
219924, 典型贺岁片，冇感想。
970948, 8.2确实有点偏高了
1616790, 姐妹的感情我挺感动的
219916, 高科技太高科技了。。
1824479, 各种槽点，各种不合理
1309248, 特效全在预告片里。。
919022, 单纯搞笑还是不错的。
662692, 典型星式喜剧，女追男
1824541, 打来打去的，都困了。
1271464, 台词不错儿浓浓哒哲理
1868583, 下一部叫广告合集~~
1868579, 我只是去看柱子哥的～
1868576, 剧本又臭又长。制作好
90245, 一个关于备胎的故事。
919032, 三俗的很开心的电影。
1509318, 张雨琦的声音让人ED
973050, 还可以吧，主旋律电影
694856, 特效牛，全程无笑点…
2014118, 好喜欢豹警官 萌萌哒
1194044, 笑点高的人谨慎观看。
1825701, so cheesey
1506650, 李鑫的蓝色oppo。
444319, 栀子花开，青春不败。
