,comment
1975599, 果然期望越高就越……
1115685, 爆米花电影，剧情勉强
390808, 良心作品，仅此而已。
1975475, 还以为在看科幻片……
640284, 受不了有的画面太凶残
1535354, 一颗童心，美人鱼之恋
932021, 看完觉得很一般= =
1280151, 真盗墓 但还是。。。
1358594, 剧情一般，特效还行。
1358598, 画面很美，剧情一般。
113107, 配音出戏，画面好美。
1535330, 别谈老套，我还是笑。
954296, 唉，教主分分钟出戏。
838736, 越是缺爱的人越有感触
1115643, 不是爆米花电影是什么
1586327, 还行呀 青春小说小说
1535071, 环保宣传题材的R级片
1586404, 3.5竟然哭两回。。
725348, 开头和BOSS战烂了
1906559, 写字要快，不要写废话
540818, 片尾的煽情令人反感。
1906575, 这剧情不单薄还想咋的
1115672, 始终对英雄电影无感~
1115674, 各路超级英雄大杂烩啊
1975647, 这是日漫版变形计吗？
155237, 中规中矩的动作片吧。
604984, 绝逼是恐怖片啊这个，
954391, 那英的插曲还挺好听。
155292, 居然这么对我妮 好虐
1535101, 失望，没想到这样难看
931925, 王宝强的傻样算是火了
1586239, 完全和我不是一个时代
1906692, 新海诚的作品一向很美
112967, 呵呵呵 绿茶婊的一生
1280179, 不是我的菜额....
932027, 只能说，还挺搞笑的吧
1585638, 比想象的好 尤其片尾
1535612, 一毛特效 俗并感动着
113392, 看一半真是看不下去。
113394, 音乐画面邦，剧情……
1535589, 简单，拍给小孩看的。
1535571, 和老公一起看。很感动
664760, 定义为恐怖片比较恰当
1132604, 爆米花而已，仅此而已
1115905, 不用看开头就知道结局
1535690, #妈咪，出咸片唔好笑
640321, 3.5其实比想象的好
1535712, 三个星全部给周星驰。
113436, 抄袭吉卜力风格太明显
595209, 其实比较喜欢大话西游
667866, 笑点少感动少，不好看
604862, 我还是很喜欢周星驰的
1115867, 原来我是来看绿巨人的
113203, 还行，没有太多的亮点
390914, 制作不错，剧情偏弱。
821019, ...音乐，色彩好评
1115768, 其实我觉得一般般……
1280202, 毕竟这特效大概一块钱
932142, 据说有人看哭了。。。
1907163, 感觉有点虚高，降一点
1975223, …(๑╯ﻌ╰๑)=3
838563, 片子很美国，没有共鸣
113276, 处于好看和不好看之间
821040, 米娅的每条裙子都想要
595172, 有几个点还是蛮好的。
667873, 里面的造型真心很重口
1200030, 只能说远远超越了小四
1961570, 表示无泪点，有点感动
1576273, 三星给星爷，多的没了
1227262, 感觉太文艺了，很一般
1282671, 陈坤好帅，电影一般般
935926, just so so
1360521, 好多魔戒的影子...
1544383, 爱可以跨越种族和界线
147155, 人力拉飞机什么道理？
147023, 美队打钢铁侠，不能忍
146965, 好久没在电影院睡着了
1576174, 周星星的一贯风格……
1961377, 画风挺好的故事小清新
935990, 每次看都会笑 就够了
1282710, 国内观众太容易满足了
146945, 基情三角，小蜘蛛亮眼
146977, 人设略崩，三星半吧。
1544470, 好失望，只能说不难看
1544473, 后半个小时一直玩手机
1576216, 2015.02.11
824333, 我们都爱自己胜过爱情
1576380, 三观不要太正。。。。
147301, 冲着钢铁侠 给3颗星
1544241, 美人鱼演技抓鸡。。。
1917155, 除了画面没什么印象 
1576596, 无敌是多么 多么寂寞
1367801, 或许是我期望值太高。
1544218, 有笑点啦，5d第一次
1119275, 剧情弱爆了。。纯看人
1544304, 与早期作品的气质一致
1576405, just so so
1576411, 剧情太简单和俗套了。
835600, 结局什么情况！！！！
147220, 人多就乱，没法细看。
1367671, 没看出什么，拍的挺好
1960980, 每一个点好像都差一点
120785, 不错了 就是有点肉麻
120767, 付出也是一种爱的表达
1918172, 果然还是不喜欢新海诚
146651, 这个系列越拍越无聊了
539261, 反正比煎饼侠好看多了
643387, 只有那个唐僧，我笑了
1575897, 讲真，真的觉得没意思
835420, 太文艺的不是很适合我
597114, 就是不爱太血腥的片子
1367661, 电影两分，特效一分。
1291068, 一堆烂片中脱颖而出！
1230139, 节奏略慢 冯绍峰很帅
936021, 徐峥长得太像我老板了
1917698, 是我矫情不起来了吗😂
949769, 比想象中的还好一点点
936004, 还不错 宝宝实力搞笑
1129836, 纯看打斗，就热血沸腾
824369, 完了，我怎么不感动。
120690, 还行，进步空间还很大
1917930, 比五厘米好看一点儿。
949697, 至少全场有笑点。。。
936031, 山寨粗俗版《三傻》！
1544701, 初一刷的电影，看哭了
603142, 那个人还是一条狗啊。
665356, 为什么总是悲剧- -
1119257, 为抖森和黑寡妇去看的
1577215, 影院，with表哥。
1962770, 感觉不如宫崎骏的电影
1916424, 嗯 没什么感觉...
603328, 让人无比失望的周星驰
1962863, 我果然不适合看爱情片
1962841, 是挺暖心的，触不到。
1577084, 一般，剧情老套，平淡
1577082, 星爷不主演没多大意思
1577094, 就想说，无厘头。。。
1577160, 周星驰的时代过去了吧
1577153, 最搞笑的部分在警察局
1962487, 大概我不是小清新……
935616, 还是比较喜欢人在囧途
1282474, 7.5分上下，虚高了
714120, 额。。有点失望😞😞😞
1543411, 六一感受星爷的童真。
1227141, “配画面的有声读物”
1543420, 朋友聚会看看挺适合。
1543434, 看的时候想到了海豚湾
148096, 这是复仇者联盟3……
596742, 说好的QTE之怒呢？
643527, 只记得4个老太太太赞
1577510, 一部很不错的环保电影
148101, 哼，就是不喜欢美队！
935611, 不知怎么觉得有点脑残
1916321, 画面好看....没了
1916359, 画面太美。故事无感。
119679, 三分给画面，剧情0分
640925, 全是大话西游的影子。
1543566, 梗老得都笑不出来。。
1577343, 没那么搞笑，有点内容
950358, 我幂的片 啥也不说了
147993, 打得只剩下热闹了……
714147, 剧情太差 特效加一星
596827, 我选择留在我的时代里
603255, 周星驰的电影都好恶心
950077, 感觉电视剧版更丰满些
824101, 期望太高，平淡无奇…
1916895, 因为新海诚，看了一点
1576725, 很新颖，却没什么笑点
1282588, 是国产片里的8分片。
1576713, 一般吧，环保主题不错
1544097, 罗志祥出场简直笑死了
1544142, 话说还是星爷亲自上吧
539360, 一般般。但对得起票钱
1916941, 很感动啊可是我没看懂
603242, 看似荒诞，其实很给力
534509, 不值8.0这个分数吧
1576712, 幸好有星爷，不想多说
643451, 文章的演技在线过吗？
1962005, 没有想象中好看啊……
1916918, 还是喜欢秒速五厘米～
1544140, 欣赏不来，看的好尴尬
534473, 我为毛一直觉得好感人
714240, 嗯！没有什么想说的！
147677, 美队正式和钢铁侠分手
824028, 可能我不爱这个类型吧
119970, 魔幻的青春偶像卡通片
1360417, 这分都是打给演员的。
1119129, 不费脑子的爆米花电影
1543772, 带着尴尬笑得停不下来
1543775, 还星爷一张电影票吧。
1577036, 美人鱼挺让人怜惜的 
1543794, 没感觉有那么好看啊🌚
1543977, 和你看的最后一部电影
1916771, 抱歉，我………………
835707, 总之不能期望太高……
596878, 看的累，但总算看完了
950111, 只是看小明哥耍耍帅的
950099, 滤镜用的太过。。。。
1962210, 流星很美 带来毁灭 
1543916, 两星半……好尴尬……
1916690, 还是喜欢秒速五厘米。
1119149, 一切都是那么刚刚好。
835723, 歌舞演员的漂亮爱……
1543955, 有一星是张雨绮的颜。
1574463, 有点失望加不喜欢女主
1283141, so  boring
949161, 主演几乎没有演技可言
1919718, 画面佳，几首配乐还行
1367349, 那啥不多说，有点困、
1546164, 还不错，挺多旧作的梗
1959040, 还不错 可是快睡着了
145435, 漫威 我真的欣赏不来
145421, 胡编乱造了，没有亮点
1574385, 剧情俗套，真的一般。
1546104, 有卢正雨，味道还行呀
1574430, 讲环保这点加了不少分
1919907, 感想太多 只因bug
145418, 7分 美队吃屎！！！
949247, 没想象中那么差。。。
1574783, 环保 正义 相信爱情
1283102, 黄渤一张口，我就想笑
714770, 有过牵挂，了无牵挂。
1574905, 不应该和妈妈一起看。
1290837, 除了剧情，都挺好的。
665437, 冲着文章同学看的..
597312, 经典之后，再无经典。
1574881, 周星星有史以来最差。
1545787, 星爷的世界是美好的。
145615, 这个系列越来越无聊了
1119899, 电影院里睡着了~~~
145585, 时间长的让人抓耳挠腮
145638, 三星片，一星给美兵~
1129441, 美队实在是太弱了……
1574724, 星爷也江郎才尽了吧！
145673, 救人变成害人，死循环
145415, 最后半小时看得我……
641140, 反正我是没怎么笑~~
714902, 好基啊！不愧是基年！
145071, 下次要忍住不进影院~
145058, 友谊的小船说翻就翻。
398949, 适合孩子看，情节简单
122112, ～～～～～～～～～～
1920426, 新海诚你好新海诚再见
145153, 能不能好好讲道理……
1574031, 贺岁片，笑一笑就好了
1573868, 紧张情绪影响观影体验
1958458, 触不到的恋人，动画版
1120134, 效果4星，其他，嘛嘛
722086, 没有评论说的那么不堪
722085, 纯为周星驰三个字而看
1573921, 奇幻色彩的桥段铺陈 
1958557, 果然是吹起来的片子。
1920590, 三分送给壁纸，哭个鬼
122145, 土楼很美，心善行善～
1546533, 嗯，场景太过逼真。。
1129261, 没有期待中的好看··
602809, 过年需要无脑笑一笑~
1120040, 比较狗血~毫无新意~
1283185, 特效满分，故事性不够
1574214, 罗志祥很抢戏啊喜欢他
1574207, 也只有一句，支持星爷
1574206, 爱护环境，人人有责！
1546290, 过溢了，笑点有点尴尬
121952, 为画面和音乐喝彩……
1574242, 讲道理。。看不懂。。
1546251, 环保的主旨总是很好的
1546225, 一般，生搬硬套严重。
714847, 特效做的真不错，嗯～
398730, 有诚意的电影多给一星
1574261, 2016.02.09
1546243, 不是很能get到点上
1574139, 爱是爱，环保是环保。
1283220, 可以！原著党表示满意
1958838, 也不是特别感动的啊！
1546316, 警察局那段笑死了的 
1920286, 故事没有把我感动到。
538990, 还行 马冬梅挺感人的
1290625, 比冯绍峰那个是强多了
936455, 无甚感觉，乐一乐而已
1545215, 搞笑的也就是罗志祥了
1960444, 我的内心竟然平平无奇
1918664, 2016年12月4日
949504, 就这样吧，没什么看头
1290982, 无剧情，3星特效分。
1575456, 一般剧情很好猜鱼太假
121067, 北冥有鱼，其名为鲲。
603035, 可是，猴子不是猩猩啦
1119708, 我的超能力到底是啥呀
1575256, 有几个梗还是很逗的！
936226, 可以找人杀了王宝强吗
539177, 有点老套。不怎么喜欢
121152, 大鱼海棠 备胎千古情
146201, 各种打斗，英雄打英雄
1545321, 贺岁片里面最好看的🙄
936254, 一般般吧感觉不如上部
641033, 就不喜欢文章那张木脸
1197442, 老板，包种还是包夜？
1575594, 这都有7分，不太好吧
1575670, 星爷，还是你自己演吧
714554, 吴亦凡真的辣鸡演技。
1545002, 女主太跳戏 寓意很好
1545005, 剧情还行吧，有笑点。
835355, 你存在，我的琴声里。
1960531, 画面很美，剧情一般！
1545139, 真是期望越大失望越大
1960566, 虽然不戳我 但是还好
146397, 英雄拯救世界 老套路
1199965, 台词能不能表这么文艺
665403, 大话之后，再无西游。
1197502, 有点搞笑 狗狗好可爱
1919159, 白了我30元钱！哭！
417650, 自来水牛逼吹得有点大
145927, 增强级的奥特曼。。。
643308," 唉,多的一星给周星星"
1545608, 2016.02.06
1575011, 没什么特别的感觉。。
835137, 景色优美，音乐好听！
722381, 真不知说什么好了……
121518, 两星给画面一星给音乐
602970, 已不是原来的一生所爱
1545701, 星爷现在是人，不是神
1919090, 内心毫无波动甚至想笑
1545439, 我妈非说张雨绮是杨幂
1545453, 营销比影片质量做的好
1545470, 周星驰  ，一字一分
1960232, 有浪漫情怀的人会喜欢
1575240, 简单剧情，复杂心情。
949424, 没啥特色，跟剧本一样
1545472, 希望越大，失望越大。
1575114, 无敌是多么寂寞科科科
1230073, 陈柏霖文艺的有点恶心
643313, 还真是没看懂-_-#
641078, 是搞笑，但也挺恐怖的
1959930, 真的感觉没那么好看，
714700, 剧情弱智，特效不错。
1367500, 我心中夏雨才是亮点…
1545478, 特点鲜明，无厘头情结
643318, 主旨很好，拍的挺好的
1545491, 中规中矩环保宣传片。
1918941, 画面音乐都是一级棒。
936335, 12/27 2012
148130, 美队是自大的圣母婊。
596263, 开始 有点像恐怖片啊
534057, 国产电影中的一股清流
1579751, 过年无聊没事干看不错
1579743, 中间有段还是挺搞笑的
1966582, 没想象中特别好吧 …
1197102, 前后格调脱节可以说么
1913637, 画面美好，剧情过得去
640728, 寝室去看的第一部电影
640740, 除了搞笑，就是矫情。
1579647, 嗯…至少没觉得好笑…
150034, 莫名其妙就看了3遍哟
1541166, 张雨绮演的是什么鬼？
420533, 剧情略弱，画面上佳。
836616, 冗长，适合伪文艺青年
1579626, 没有爆点呢，没被惊艳
1966641, 故事一般 勝在畫面～
150316, 杂8.5的 好意思么
150293, 美国队长你不要装逼了
596217, 有些镜头剪得太粗糙了
603891, 一万年太久，只争朝夕
596252, 大话之后  再无西游
1540991, I laughed 
1966664, 没有传说中那么感动。
394828, 一个非常不一样的大圣
934550, 也没那么好笑啊。。。
1292317, 没看着特效，就先这样
1230516, 也就音乐和摄影好点。
1913550, 打三星会被视为异类吗
117889, 女主真是盛世白莲：）
1541477, 呵呵一笑，有何不可？
1541482, 星爷的片子……太一般
1292170, 跟我想象的有点差别。
149674, 在泰国暹罗广场看的。
1965884, 想到了汤显祖的牡丹亭
1118264, 特技很炫，亮点不多。
149667, 在飞机上补完了呵呵哒
603768, 开头真是会吓坏小盆友
1579263, 故事和情节有点…老套
713667, 吴亦凡把我看的好尴尬
1541459, 嗯，生态环境保护片。
149711, 是不是打来打去来着？
1579156, 只是为了周星驰。。。
1541592, 三星半吧 只笑过一次
1579208, 我真的觉得很一般一般
1359941, 又名 寻找安吉拉北鼻
1541531, 有些地方太血腥了。。
1541540, 总共笑三次就给三星吧
150007, 再次确认了我不喜欢。
1579335, 我笑的不多，吓的多。
1579545, 给张雨绮，真的很霸气
1541278, 真的超级一般啊！！！
1579513, 对环保的描写太刻意了
1292242, 真人版老滚5地宫模式
1579586, 不喜欢结尾 强行HE
1541248, 不抱期望，方得五星。
1359924, just so so
951254, 都推荐我去看电视剧…
149745, 蜘蛛侠就是出来搞笑的
1541423, 剧情和演技生硬，三星
1579431, 还行吧！要保护环境～
1579417, 小人鱼还是蛮美的。。
1226884, 我们的男神都在发神经
951307, 哭哭哭哭哭。。。。。
1914086, 比秒速五厘米好太多了
951302, 霸道总裁爱上我呵呵呵
1580039, 除了演员，其他还行。
604000, 谁他妈说这电影血腥的
1580635, 主题深刻，好看性一般
1292492, 夏雨倒是让我眼前一亮
604003, 星星全部给黄渤。。。
713379, 林允胸好大，林🐶好帅
1580679, 说实话，有一丝丝失望
1912688, 12.02和柳哥哥看
1540253, 寓意很好！迷之尴尬！
1580524, 期待国产电影越来越好
1281613, 三个星全给舒淇的大胸
1912869, 原来我不喜欢新海诚。
1912875, 重要的 不能忘记的人
951830, 2015-07-16
603991, 绝对是恐怖片。。。。
934282, 不如《人在囧途》好看
934289, 还行，还是让我笑了的
1912824, 回想一下，感觉一般。
1580474, 无厘头 环保 人鱼恋
1580889, 总体来说还可以吧  
151098, 感觉人物性格变化太大
934166, henhaoxiao
1197052, 太文艺的片子，看不来
934149, 也就这样。笑大不出来
1539912, 感觉笑点都在罗志祥…
151140, ……吐槽怎么都那么冷
1200404, 想装结果装出个四不像
1580901, 完全get不到笑点。
934157, 还行，跟第一部好像啊
1540029, 环保外衣下的爱情故事
643794, 一万年太久，只争朝夕
1292508, 文戏和爱情戏很僵硬。
604013, 看完就没有记忆的电影
604023, 给青岛贵妇和结尾点赞
1197069, 喜欢是放肆爱是克制。
1368564, 一般般 有八分？？？
1967268, 太矫情，诚哥还需努力
1540629, 超长环保♻️宣传片。
539923, 陪伴是最长情的告白。
533988, 不太喜欢这类型的电影
150615, 真的很一般，很一般。
150611, 真的无聊到觉得很漫长
539935, 笑得我尴尬癌都犯了。
1359771, 还是比较及格的商业片
394613, 盛名之下，其实难副。
1580089, 生硬的好看诶好吧一般
934461, 人妖这一个很有特色~
1200349, 一路装逼，后会无期。
539905, 小品大联欢，挺逗乐的
150440, 2016-09-16
1117932, 锤基。。。。什么玩意
1281710, 可以比九层妖塔多一星
1197083, 韩寒还是去写杂文吧。
1117890, 对大片真的没什么感觉
1580112, 三星给老奶奶的尾巴。
150618, 不是美队，是复仇联盟
723786, 特效不错，还挺搞笑的
934319, 笑一笑吧，没啥大不了
1912948, 新海诚不太会讲故事呀
150673, 《美队三：恩断义绝》
1131056, 美式大片，一笑而过~
1117779, 生日那天看的、头好晕
150735, 纯粹喜欢洗几个演员🌚
150729, 美队这三观太不正了吧
150727, 超级英雄审美疲劳？？
1540460, 再也不想吃海鲜了……
1540534, 只有罗志祥那几段笑了
1913010, 请怀着少女心观看此片
1580279, 女主老是让我想到大S
713455, …………………………
1197076, 3.5还行的公路片阿
150670, 美国队长3-英雄内战
1540476, 没那么神，也没那么坏
723769, 吴亦凡演技扣掉一星半
603965, 各种残忍死法儿童不宜
148707, 看的我都打瞌睡了……
596610, 找不到泪点和笑点。。
1230356, 被捧得上天，不过如此
1578170, 满屏都是张雨绮的大奶
935373, 没有第一部好看啊……
713975, 给三星，也是因为徐克
1542713, 还有 有笑点 无剧情
723155, 特效满分，剧情。。。
1578101, 至少是为了环保拍的。
1227039, 整部剧充满韩式幽默~
596641, 有笑点，也有点重口味
1915670, 只有我觉得剧情很烂吗
1360203, 一讲盗墓就tm没劲了
396180, 你是猴子请来的救兵嘛
950669, wz万达，感觉还不错
1291799, 比隔壁那部好的多的多
1197234, 可以当台湾小电影看看
1542550, 不知道应该说点什么…
596568, 难道真的不是恐怖片？
640840, 总有对比。总有进步。
1578335, 电影2分 星爷加1分
1118600, 三星给女神和抖噜。。
148912, 萝卜芹菜各有所爱……
1915311, get不到情感共鸣。
1130420, 帅哥很多，剧情你懂的
119005, 你若安好，备胎到老😂
1118668, 没什么好评价的。。。
1291847, 带着眼伤，看着略累。
603542, 西游的背后是什么故事
1578275, 反正看完很想吃小章鱼
603553, 笑点有，但剧情不精彩
603551, 好，但不至于4星..
1578268, 欠你的电影票补上了。
1915366, 只能说，好动画有很多
1542905, 是他 但是 不是我们
1542907, 文章那段最搞笑。。。
148283, 自己打自己闹着玩😂😂
1118873, no comment
1291718, 特效不错 剧情不够好
950476, 可惜了剧情了 这演员
596692, 舒淇一如既往的美啊。
1543180, 无敌是多么 多么寂寞
1577752, 文章演主角应该会不错
950519, 烂片，就是冲原著看的
1963423, 画面唯美，剧情一般。
1118860, 为什么擎天柱没有来！
119426, 良心制作！蜜汁三观！
1227101, 因为钟汉良，减一颗星
1130244, 嗯。挺热闹的，很热闹
1368054, 有点无聊，字幕两边跑
665274, 大话之后，再无西游。
1543257, 俗套的剧情，🐙很搞笑
1130266, 建议直接看最后一小时
1543154, 三星半。人鱼是哪位？
1291744, 制作精良，故事弱了点
935472, 真的是为了黄渤咳出血
419372, 特效一流，故事薄弱。
1577915, 给三分是因为环保主题
1577974," 我笑点真的很低。
"
539543, 别到了失去才懂得珍惜
148381, 妇联2.5装什么美队
1282364, 我是真没认出来陈坤！
148333, 这分明是妇联3前传吧
534348, 眼前的总是好的   
1543068, 前一半两星后一半四星
935481, 只清晰记得一个笑点。
723069, 其实我觉得还行啊……
1963551, “好看”然而喜欢不来
1577833, 实力干不过野心系列～
1541891, 张雨绮很美，就这样了
1360023, 帅舒淇。反派太脸谱化
1130622, 最好的科幻片都是还行
1541945, 笑点1分，2分给星爷
1541850, 就，挺一般的吧...
1578875, 三星吧 特效简直汗颜
1578732, 还不错啊，一直在笑～
395605, 希望越大，失望也越大
149253, 有些失望，说教太多。
596458, 一万年太久 爱我现在
1541683, 无敌是多么 多么寂寞
1541696, 除了情怀，没有其他了
643684, 孙悟空败笔，我觉得。
596403, 总是感觉没有之前的好
1579118, just so so
539768, 原来故事都是一个套路
118235, 女主太作看的让人上火
1541629, 星爷已不是那个星爷！
1914415, 动漫版的触不到的恋人
640785, 孙悟空造型真让人失望
1914485, 为画风配乐和脑洞点赞
1368325, 给小胖子和特效的星。
534165, 确实搞笑，但三观不正
1130667, 各大英雄的天下。。。
1578946, 無敵最寂寞的是人類。
1579000, 没想象中的好看，一般
1914512, 我以为我还有少女心的
1915083, 剧情设定上有bug。
1118540, 老美的套路剧~~~~
118767, 一不留神动画片变韩剧
1542398, 一般般，没啥笑点。。
1282145, 一般吧.......
1542271, 还星爷一张电影票的钱
1542278, 对星爷的喜剧有点失望
1291940, 棺材戏恶趣味太浓重了
1578488, 有点血腥，个人觉得。
1226965, 睡了三觉，电影结束。
603609, 我说这3D坑爹你信么
950882, 看完左耳 回来加一星
1578370, 女主让我分分钟想打她
395814, 画风不错 结尾太仓促
1130519, 唉，都挺好，除了剧情
950889, 更喜欢这版 比较入戏
1118550, 我们有浩克！[哈哈]
1578512, 星爷迟暮，老梗。。。
1282104, 黄渤陈坤装的一手好嫩
935227, 哈哈哈哈哈哈哈哈哈哈
1914817, 可能诚哥真是个足控。
603640, 一生所爱不要乱唱谢谢
1965004, 故事情节编排得不太好
1578668, 周星驰的白发童年梦。
935257, 第一次和妈妈看的电影
1200211, 反正我不喜欢，除了狗
1578533, 无厘头很过 星爷不星
935255, 范冰冰的出场惊艳到我
1360084, 特效棒，其他不在线。
950948, 晓明哥的下巴也是醉了
1230407, 嫖客劝妓女从良，哈哈
589070, 美国的英雄大侠太多了
911172, 由冰冰黑轉為冰冰推.
983330, 如果旁白去掉会更好点
1849795, 给李冰冰和大黄蜂点赞
1478175, 一般般，小耳朵挺美的
636773, 这片子可血腥了。。。
344619, 中规中矩;不想去捧杀
911186, 期待与现实不尽相同。
212753, 成龙老了，剧情花哨。
212746, 流水账翻页速度的电影
1849696, 好乱啊 没有上一部好
1192428, 虽有情怀，却少情节。
1832688, 纯看擎天柱变身...
1832706, 新三部曲变烂的开端。
616458, 看着有点血腥。一般吧
198597, 心疼铁铁！嗷嗷心疼！
1491656, 吾校的镜头忒少。。。
1221984, 给个三星吧，鼓励一下
585360, 没有复仇阵联盟里的萌
616471, 口味。。。略重=。=
1832665, 弄得这片跟山寨的一样
1634569, 最起码选角上是认真的
905502, 搞笑的时候请勿煽情。
911216, 没感觉，就是喜欢徐峥
1492038, 小耳朵 你长得真好看
1850006, 勉强打个三星，太烂了
1849992, 打来打去，打广告也多
1090050, 期待太久。略为失望。
983206, 枪战过多，情节夸张。
613672, 放眼望去，满地星星。
1492014, 我竟然看了这部电影~
1634266, 没有起因经过高潮结局
524554, 又一部穿越的搞笑喜剧
1096375, 电影版《hero》？
1849987, 要看两遍，噁心死我吧
344561, 只想说配乐是什么鬼？
911303, 笑过之后什么都没有。
1850063, 电影时间禁止插播广告
739145, 特效很好看。还算有趣
1492095, 还是虐待，翻拍的一般
212848, 没有什么词语可以置评
613662, 情怀不再，非常失望。
198216, 心疼托尼到无以复加 
1379812, 视觉效果棒棒的 推荐
1491933, 就觉得杨洋和欧豪帅了
1849872, 中国元素依然是败笔。
344601, 情怀可嘉，但真心一般
1849867, 天坑原来离香港这么近
356065, 痞子英雄之路总是雷同
983251, 主旋律影片打动不了我
