,comment
667020, 这是一个另起一段的故事
538690, 跟同档期的港囧一个主题
659960, 没有星爷压阵还是不行啊
628856, 为毛和尚还可以拍拖？！
628959, 一开始还以为是大白鲨呢
601993, 猴子是猴子猩猩是猩猩。
1321697, 这里的陈坤看着像张震…
1365309, 特效还不错 就是略不懂
1310697, 不太喜欢盗墓题材的电影
630312, 就知道不能报这么大希望
1241960, 段子还行，剧情不敢恭维
599623, 有了文章 电影就没法看
602558, 特效差了点，剧情差了点
617532, 还是喜欢95年的~~~
522954, 挺讨喜的 有搞笑有道理
582111, 总感觉是贾尼的爱情片儿
1321688, 感觉演技过头就有点做作
538890, 背景音乐不错，剧情一般
552076, 有笑点，有感动，无内涵
1242494, 告别少年的最后一次旅行
1398362, 张艺谋啊，让人挺失望的
1283624, 三个字，一般般，不好看
659933, it just ok。
578959, 《思聪与他的钢铁战衣》
1327063, 我就看下彼岸花，拜拜。
602757, 剧情上还是有点烂。。。
616107, 磨难完了猴子改蹉跎玄奘
1290251, baby美到我了   
1343601, 一般 3.5不能更高了
1258744, 作为导演韩寒还很稚嫩呐
1206809, 一直很爱公路片 很韩寒
537219, 挺搞笑的，笑笑就过了。
1237088, 岳父怎么不出来晒姑娘了
1361227, 剧情差   贝贝看着傻
1184484, 段子手的散文，看个乐。
666713, ……不咋滴  不解释。
628516, 这不科学啊，这么高的分
1283467, 比九层妖塔好，比预期差
675918, 打的好爽，悟空扮的不错
1290272, 经费受限 特效不佳……
672345, 故事还是有可发掘空间的
1262178, 韩少格调略高，够不到。
600792, 得不到皆因想要的太多。
660653, 江郎才尽、三星安慰分。
649568, 猪妖那部分真是恶煞我了
580954, 臭屁的iorn man
1323260, 不可否认的失望了→_→
1207584, 最大的感受就是很矫情。
641926, 文章，你赢了~~哈哈哈
635380, 正义还是需要高强的功夫
599737, 佛祖和地球一起出现还行
1237241, 第一次听段子听得心好累
1326833, AB的演技真的是。。。
1199762, 我喜欢那条狗和朴树的歌
582546, 牛人就是置之死地而后生
1283539, 最大的亮点貌似是舒淇。
1361831, 看个乐呵吧。没什么意义
599723, 在河北沙河市 看了开心
538775, 看完话剧电影就没法看了
524510, 立意较低。演员表现不错
1309875, 比九层妖塔好多了...
599238, 几颗老鼠屎 坏了一锅粥
1339785, 到现在为止国产3D巅峰
634898, 正牌出版社才是业界良心
1213150, 也许我们此生只见一次。
1323251, 建议看3d，效果很不错
580116, 我遜到現在才看ˊ_>ˋ
1325022, 中国这类影片里算好的了
641221, 开头不错，结局很微妙。
538338, 得不到的永远最好。。。
524844, 不好意思，我没怎么笑。
1227623, 为冯绍峰 陈柏霖- -
602632, 无法超越的原版一生所爱
514677, 不适合我。真笑不出来。
617456, 我倒觉得不是给朱茵的呢
1339775, 不惊喜不烂尾 无功无过
1220223, 陈柏霖！！！袁泉！！！
1307949, 真没看到尊重原著在哪里
1237273, 欢乐中带有些触动~~~
513866, 挺搞笑，但是没什么内涵
618397, 第三星给我喜欢的黄渤。
1229097, 韩寒的路还有很长。。。
655853, 有笑点也有尿点，还可以
660518, 特效还好，结合了东西方
616161, 妖魔化了猴子。不喜欢。
1206836, 7 更像小说而不是电影
579797, 动手能力强，PK王中王
1229656, 怎么也有三星吧 给韩寒
1290350, 夏雨，黄渤，是好演员。
1323749, 20151223看过。
675931, 6.8三星半，不吹不黑
1285313, 剧情比较垃圾，凑合看看
1284341, 上过床了就是女朋友！！
522394, 三星半吧　平凡人的幸福
1235949, 韩寒离伍迪艾伦还很远啊
1340260, 剧情比较薄弱，特效好评
1229033, 很一般，钟汉良那段不错
552646, 值回票价，但不值这评分
582608, 不错的啦，很早就喜欢看
648715, 我真不信这是周星驰拍的
1308887, 特技还行，但是没剧情啊
1326951, 再好看也是薯片，别嚣张
1364577, 果然还是太高估乌尔善了
1290371, 剧情也太.......
598342, 看完后有怅然若失之感。
578880, 第一代和第三代差好多啊
672256, 王终见王就给我看这个？
1285865, 好想带着陆川一起去看。
1308896, 咱能好好盗个墓探个险吗
675537, 孙悟空打斗还是蛮帅的！
600849, 玄奘西天取经前除魔历程
1323765, 比九层妖塔强那么一点。
1287610, 特效点赞，剧情太单薄，
523739, 看完影评才知道精彩之处
1213337, 我真想评个2星，矫情死
667190, 有点失望，但是不会太差
666566, 想颠覆，功力还有所欠缺
1198911, 冲着朴树的歌去的。实话
617164, 比预期好看不少……笑色
665555, 猪肛裂的脸真的很油!!
1199774, 文艺青年的理想主义世界
628874, 周星驰 电影 2013
666217, 就两个地方好笑，一般般
649970, 没电影看才把票房飙高的
582075, 就为了小辣椒点个赞吧 
1310652, 居然被陈坤的颜值懵逼了
1184463, 暑假和同学看的…一般吧
635600, 2333其实笑点蛮多的
1342371, 不知为啥，感觉一般般。
1244701, 说实话。。。我看不懂😢
1288176, 一般般不过陈坤真的好帅
538744, 好笑是真 谁叫我笑点低
1285375, 回忆，心理活动太low
649132, 不是大话西游3，新剧情
618480, 我居然半途而废了。。。
619269, 三星与四星之间的赶脚？
598545, 中规中矩的爆米花电影嘛
655497, 不是很好看 没什么意义
666760, 有失望啊 有点扯的感觉
1190675, 果然不是谁都能当导演的
1227449, 配乐还行，剧情吗，喝喝
1321595, 四年的时间做了特效。。
1322351, 没有说的那么好看啊……
617627, 拍来拍去，还是那几样。
580717, 看太多美式英雄的电影了
1398857, 至少比匆匆那年好吧。。
1360926, 也没觉得有多么多么的好
672043, 想象力不错，口味也挺重
1327242, 比九层妖塔要高那么一点
1366824, 无功无过。完成度不错。
1343447, 不说故事 笑的蛮开心 
660548, 只想说没有前面两部经典
1339565, 一般般，完全没必要3D
1283745, 演员选的好，口碑没烦恼
1289157, 一直在墓穴里 视觉疲劳
617203, 鼓掌。但印象不会深刻。
524570, 男主就是个得陇望蜀的人
1324123, 烂片一部，完全不能入戏
1308450, 我觉得胡八一不死很牵强
660708, 除了儿歌三百首无亮点。
629057, 有一种星爷老了的感觉。
1327224,  劇情夠緊湊 看著不累
1309953, 整体还好，剧情一般般。
635365, 猪八戒真的太恶心啦！！
539014, 在家看看消磨时间还不错
1342312, 看到了国产商业片的希望
1324129, 给片头一星，其他的……
1190098, 没共鸣？没感受？。。。
538408, 4分给笑料，三观-1分
1212163, 纯粹来看大仁哥的。。。
599564, 哈哈哈那个油亮的豬剛鬣
615895, 这应该是恐怖片吧。。。
1213277, 公路上的事儿，都是二货
566689, 英雄电影我都不太来电。
1207457, 剧情无聊全靠段子撑场面
1220097, 无助感。过几天再看一次
655634, 忘记在哪里看的了。。。
634852, 诶哟喂 真的乱的大杂烩
600544, 给特效加一颗星吧。。。
1244900, 诚意十足，但缺乏计较。
1197919, 当一辆车消失天际。。。
597833, 舒淇很美。不好笑的喜剧
579712, 世界已经无法阻止人类了
538413, 抄就抄了，剧情也太夸张
1287812, 国产电影这个特效很不错
550639, 一个字，寡，淡的无味，
1398454, 我觉得这好像一部喜剧片
582384, 不错！呵呵……高科技！
580031, 小罗伯特唐尼.....
1384291, 这才是正宗的摸金范儿！
551091, 有诚意，有惊喜，缺底蕴
642062, 嗯，还是更喜欢越光宝盒
1283098, 夏雨你这些年都在干啥？
666687, 文章身上满是周星驰烙印
1360855, 7分，方特5D电影水平
1310208, 发大招前先念咒语 十七
538117, 比较好笑但哪里怪怪的！
1326068, 特效不错 真是鬼吹灯？
628270, 周星弛太疯，重口味搞笑
1287819, 黄渤陈坤这个cp可以站
1285147, 还可以，想看看小说了。
1236745, 现代社会一切都是在离别
513465, 非喜剧党表示么那么搞笑
1289095, 结局太仓促 评分虚高吧
598575, 一般吧。。真的挺一般。
1283074, 就还行吧，故事好无聊啊
635160, 我觉的猪妖的爱情最感人
642057, 一萬年太久，只爭朝夕。
659502, 老少咸宜……喜欢文章~
630368, 结尾是个难以忽略的硬伤
1228688, 8-11 with u
598554, 一万年太久，只争朝夕。
618313, 那个孙悟空被毁得太彻底
671526, 到最后完全是比谁体积大
616263, 无厘头依旧，但略血腥。
522598, 呃，一部快销式电影吧。
1286381, 特效进步不小，值得鼓励
1343225, 电影特效可以媲美大片了
1322368, 剧本弱，大片感出来了。
1386773, 你要。。这卡司有何用？
1322384, 不错我喜欢！有一点回味
1340843, shirley和胡八一
599008, 一般了，票房爆那么厉害
1398450, 先马一个三星，看完改。
1290003, 除去舒淇，其他都还可以
600025, “你有没有死过老公啊”
1236300, 各种黑色幽默，可以看看
1197517, 说不好看就会被骂没看懂
648634, 世间之爱，无大小之分。
1285154, 还可以吧，国产水准之上
1199906, 不同的人会有不同的感悟
616266, 史上最不靠谱取经四人组
1288491, 特效不错，剧情人物弱啊
581835, 我好喜欢Jarvis！
1384579, 在国产电影里还算可以吧
655946, 没有星爷以前的电影好看
1399608, 爆米花电影。看过即忘。
597472, 。。。角色都很丑。。。
642844, 一种说不清道不明的感觉
582745, im iron man
565904, 中规中矩的超级英雄片。
524012, 没啥内涵，笑笑就过去了
535489, 评分虚高 也就泰囧之流
565900, 真的只有男生喜欢看吧~
1219520, 感觉全是段子和名言名句
628378, 血腥的东西都有所畏惧。
643237, 有星爷的风格 但不够冷
642278, 猪八戒变帅了，帅的流油
1362023, 1月7日晚，多功能厅。
1191200, 沒什麼感覺的公路電影。
1212248, 三星半，期望值太高了。
597816, “我要的是现在的爱。”
599907, 2D就好 3D有点坑爹
1283238, 场景不错，嗯，场景不错
1386996, 形式大于内容。没有心。
649246, 笑完什么都想不起来了。
1198204, 一句句台词拼出来的电影
628372, 又伪3D。必须用舒淇。
1325453, 觉得那个阿姨演的🐒尴尬
641251, 我只是陪你看的这部电影
1286215, 国产片不错了 比想象好
1343007, 特效没话说，故事有点弱
1288361, 怎么说呢？没想象那么好
598436, 只是好笑，离经典有差距
1307873, 豆瓣的评分是水军刷的吧
523160, 没get到point…
1220256, 你这种情况是要加钱的。
649313, 帅哥就算光头也会很帅！
1367210, 大烂片 有点小看点而已
1323080, 可看可不看，三星给特效
601372, 刻意的二逼情节，做作〜
655669, 后面难看。鱼手短。门。
581938, 英雄主义 而且还是财阀
1207553, 处女座拍成这样 可以了
616497, 一般啊。。。血腥。。。
1219995, 喜欢的配乐，都不是原创
1244068, 认真过好相聚的每一天。
1259776, 整部电影我就在看那辆车
1190549, 从不看韩剧，这次是例外
1307569, 效果做的不错，其他一般
578971, 论钢铁侠是如何练成的。
1206875, 我这个年纪有点看不懂~
642286, 爱文章，其余的嘛不说了
655944, 有点意思，也有不少尿点
1398197, 彭于晏戏份竟然没鹿晗多
1343201, 情节不强，人物刻画不够
597493, 为什么猴子猩猩都搞不清
1340691," 3.5,给国产一个鼓励"
1308018, 可能是期望有点高...
666005, 有些惊悚 没想象中好看
1324021, 两星给黄渤 一星给配乐
1284580, 晓庆阿姨太彪了 哈哈哈
629720, 笑点太生硬感情戏太突兀
671975, 2017年已看043。
1198816, 结局把整个片子都毁了！
1290041, 不好意思我睡着了...
1366099, 画面还可以，剧情一般。
630767, 一般般，很一般呀。。。
671517, 设定好玩 孙悟空很帅～
524968, 换一种形式怀念青春爱情
1342531, 算是国产电影比较好的了
618006, 感觉一般，不如功夫够劲
1212912, 伪文艺青年的无病呻吟。
617590, 挖道士鼻孔 挖啊挖啊挖
1322308, 至少，把故事给讲明白了
671301, 难道因为我看的是粤语？
660143, 就感觉黄渤演的听喜感的
1342959, 陈坤是亮点，霸气威猛。
514270, 一个梦而已，何必当真？
1285217, 只是一部标准的类型片。
1236636, 看不太懂  没什么意思
1236309, 为韩寒而看，期待过高。
1307856, 还真比九层妖塔好看很多
1189690, 终于看了……真的是……
1184589, 对剧情失望，对歌不失望
514818, 不要太认真，笑笑就行了
1326126, 陈坤的演技竟然爆了黄渤
654578, 星爷的东西还是搞不懂~
629390, 有亮点 但是觉得无高潮
671379, 唐僧你不配思念段小姐。
1326399, 刘晓庆的头好像保龄球啊
1287256, 挺无聊 大陆限制太多了
667249, 国产大片里边算不错的了
628368, 要求不要那么高，还可以
635556, 还好了，剧情挺紧凑的。
535915, 只有我觉得一般般吗？！
655033, 一万年太久，只争朝夕。
1220444, #2016.2.13#
1385483, 拍出了指环王的感觉……
615945, 我也有大话西游情结。。
1207381, 作为曾经的韩粉，小失望
1364774, 刘晓庆的演技真是太差了
1198197, 韩寒想表达的内容很多。
1189376, 11.08 一次签到。
629028, 有点血腥，像恐怖片啊！
1212254, 我可以说，我没看懂么？
642028, 不太喜欢这阴暗的调调～
1198822, 如果是小说的话会比较好
671840, 学学人家唐僧的管理水平
580049, 发烧的时候在宾馆里看的
537056, 是好笑的⋯⋯然而⋯⋯🈚
1260689, 刚好放完的时候我睡醒了
601223, 国产片看多了会降低智商
552121, 在国内喜剧中算很好笑了
598481, 符合周星驰的一贯套路。
1321641, 确实吹捧得有些过了……
1387025, 没那么不堪，别那么酸。
602847, 文章和舒淇不够来电啊~
1227490, 普通吧 电影不是这样的
1190278, 喜欢韩寒的人自然喜欢~
1351500, 为什么要请杨颖？？？？
1208175, 一部大众汽车超长广告。
1207701, 没有那么高深，云里雾里
1390584, 张掖丹霞地貌还是美啊。
1275437, 评分好高啊。特效蛮好的
1186435, 文艺青年不好装。！！！
1202272, 比变形金刚好看1亿倍。
1317292, 不好看啊不好看 看困了
1331954, 一出神经兮兮的PS话剧
1355125, 就故事来看还是蛮好看的
612068, 幸好没去电影院看。。。
612036, 虽然也是烂片，算这样啦
612042, 我TM还能去哪？笑爆了
668844, 还行，缅怀一下大话西游
1390593, 景甜口语有四级水平吗？
1217434, 将散文以电影方式表现。
608009, 中国风格展示的还不错。
1298468, 除了剧情，其他都很牛逼
612101, 。。。。。剧情有点恶心
1335919, 没有书中那么惊悚～还行
1355184, 至少比另一部盗墓强几倍
517813, 完全不能抓到点上。。。
632228, 没有get笑点和泪点。
575223, tony是天才的故事！
1233907, 还行吧，当年我偶像啊！
1335898, 能想象中好，但也不算差
587202, 英语电影赏析课要求看的
1390577, 鹿晗演的都比景甜好……
1298423, 国内爆米花还像模像样的
647167, 故事不算新，但超出预期
663679, 故事情节很紧促，还不错
571454, Tony实在太帅了..
608040, 这次是真的觉得舒淇很美
571619, 嘎嘎闹猛，看看这个系列
632293, 葫芦丝版一生所爱...
1210006, 还是喜欢美国公路电影。
1215722, 第二个看睡着的电影。。
657303, 頂星爺  但是不爽文章
1224583, 没故事，没特色，没情节
1233822, 期待韩寒的下一部作品。
587369, 情节好单薄，反派好孱弱
611937, 星爷可以考虑一下退休了
1187895, 豆瓣评分未免有点过高了
591482, 後半段狗血出翔 差評！
608100, 舒淇演的挺不错的。。。
612015, 其实有点想给两分的。。
1349191, 场面还行，故事情节简单
1222742, 哈哈王大锤意外打酱油！
1303452, 还算不错，没什么惊喜。
1314115, 两位女性角色扣了一星。
1215678, 岳父段子手，伪公路片。
1275376, 除了感情回忆戏很出戏。
1314147, 我就把星给我们家坤儿了
1249557, 再见，也许真的不再见。
520069, 对自己好的人一定要珍惜
1275336, 本片主题move on
1238620, 一般，将道理拼凑成电影
658464, 里面的搞笑还做的不错。
1187994, 几个小短篇。袁泉真漂亮
1394081, 张艺谋比冯小刚还烂……
607780, 不好笑，不感动，有诚意
645501, 电影两星，一星给周星驰
1215549, 岳父处女座，三星可以了
639158, 一万年太久，只争朝夕。
1222628, 作为公路电影两星半……
1275851, 相比较已经是业界良心了
624917, 哎，真不知道说什么好！
607805, 不伦不类，笑点极低。。
571326, 在影院看的第一部电影。
1204422, 生硬，最多只能算及格。
559236, 讽刺，讽刺，全是讽刺。
633435, 还好，不过也就那么回事
1224770, 喜欢是放肆 爱是克制。
1222625, 各种道理堆积起来的电影
517718, 付费小品……但是搞笑！
632183, 柴静对星爷的专访五星！
591945, 喜欢聊斋化的西游创意！
607717, 还行吧，过年，同喜同喜
531118, 黄粱一梦，喜剧效果有了
575384, 还行吧，反正也是爆米花
543237, 结尾的强行抒情有点尴尬
621890, 注重剧情，没必要3D。
663726, 看一次没兴趣再看第二次
1215542, 6/10，差不多了。。
1186352, 钟汉良真是骗的不露痕迹
607750, 说实话  挺让人失望的
1202170, 实在是，一般般....
1317513, 剧情一般，小说好看多了
571410, 比蜘蛛侠好看，我认为。
520154, 剧情挺俗的，情感不错。
1390502, 特效用心了，剧情不及格
1275649, 最后二十分钟砍掉就行了
1349095, 鬼吹灯不好拍，值得鼓励
1224700, 王珞丹不错 其余皆逗逼
587131, 整个系列都看过！看热闹
1232173, 挺逗的，也有无厘头之处
1233931, 韩寒真的还是适合写书。
663691, 那时的朱茵比舒淇美太多
1390530, 纯特效片，适合去看巨幕
1195335, 三傻西游记。段子略多。
1232176, 其实蛮无聊的，看不太懂
1233919, 为了段子设计的剧情么？
517773, 不考虑三观的话还行……
1215564, 歌好听 要求那么高干嘛
1355258, 期待和现实差距有点大。
527834, 但是沈腾好可爱马丽也是
663711, 前面还不错 越来越狗血
1217507, 冷不丁的就能来一句金句
543305, 这场梦做了好久 三星半
1224746, 我只想看一部平凡的电影
668783, 好看在哪里！！！无厘头
647202, 果然是玄幻恐怖片。。。
547314, 一般吧。就是梗有点老。
575293, 典型美式英雄，只看特效
663707, 朱茵的眼角眉梢，都是戏
591807, 太过了，太杂了，太乱了
1317419, 3.5  陳坤好帥！！
1298263, 商业片or爱情片？？！
663594, 这，，星爷我不懂你。。
622089, 三星给黄渤。我恨3D。
1349654, 一般般。不过陈坤挺帅的
1373854, 三星给特效，剧情负分。
638903, 风趣幽默~特技还可以~
1393592, 除了特效啥也没剩。。。
591160, 爆米花片子不能讲内涵！
1332332, 一般般，和预期的有差距
587646, 铁罐儿首秀，还算不错。
651423, 我特别喜欢水里那条大鱼
611719, 一万年太长，只争朝夕。
519903, 还不错，相比更想看话剧
1299283, 故事好看，就是没内涵。
591170, 里面的罗志祥是个大笑点
611787, 感觉一般，也不是很喜剧
608356, 黄渤真演技 舒淇真女神
1299187, 效果还行，剧情就那样喽
608358, 里面都是野兽啊 太丑了
591201, 真没传的那么牛逼好么！
1202477, 史上投资最大的小品。。
528128, 三观不正，但确实搞笑。
1195132, 各种主题曲插曲占3分。
1303200, 消磨时间还可以的。。。
632368, 黄渤就是演技的代名词吧
608361, 罗志祥要不要这么有喜感
647016, 一个鬼 放了个屁 死了
624433, 有惊喜，少儿真TM不宜
1269778, 三个女演员表演可圈可点
1299456, 只能说比九层妖塔好看些
1239890, 这个片子和朴树搭不上。
1299452, 卡司很华丽，剧情一般般
571956, 有钱人去死好吗（满脸血
1186660, 邓紫棋的歌不能更好听！
543974, 要说优点可能是接地气吧
1222915, 其实比小时代好不了多少
1335504, 分给的是特效场景和陈坤
1250091, 说实话 没有达到期待值
1209917, “开篇就知道这是韩寒”
611631, 很一般诶……时不时出戏
1250075, 很多词句都值得仔细回味
1232408, 一般，不烂，也不出彩。
611635, 虎头蛇尾，星爷还需努力
1233788, 现实远比想象的复杂得多
1335530, Baby演技分分钟出戏
638879, 无聊电影，真的没意思。
591109, 没有舒淇就真看不下去了
556592, 两次人生都是渣男好么 
1390915, 挺好看的啊 我说真的啊
1274773, 剧情的转承有些莫名其妙
624493, 《芦苇荡》《一生所爱》
1377581, 还以为杨子是邓紫棋演的
1186655, 搞笑有余  犀利不足 
591074, 畫面很奇幻 本質很十三
1195103, 轰轰烈烈一次生命不白来
1349746, 没有想象中那么好   
574808, 标准好莱坞科幻片一枚。
1202535, 当八零后说相声来看吧。
632408, 期望略高  有点小失望
543923, 三观不正，但反映现实。
652518, 個人認為是鳳頭豬肚蛇尾
1193442, 笑声中夹杂着无奈或感慨
1335722, 陈坤好帅。要看电影吗？
575005, 前面好看，后面就不咋滴
1298881, 好多无解的剧情，why
1335735, 画面可以故事剧情差了点
1222816, 方舟子为什么没来打假？
652562, 卧次奥，一开场就吓尿了
1275068, 感觉自己都是在看绿幕。
543712, 没有想象中好看，还行吧
1232312, 金句子多，部分剧情尚可
1204246, 请不要深究，笑过就好。
1298911, 我觉得豆瓣的评分有点高
1208892, 缅怀自己的高中时代……
1186506, 看不懂 反正比小时代强
1354871, 虽然仍然觉得毁了原作。
587389, 没新意的剧情。但够帅。
1193387, 没有诚意，微博段子合辑
1275148, 除了演员，其他都挺好的
543651, 接地气，开心就好...
1222812, 我是韩粉，我给三星半。
633331, 笑完后就森马都不是了。
608311, 难道我的笑点越来越高了
622181, 一万年太久，只争朝夕。
1299042, 是盗墓还是洞穴灾难片？
624599, 还是理解不了星爷的电影
652529, 一万年太久，只争朝夕!
591288, 看在星爷的面子上多一星
546992, 最后一幕感人QAQ哈哈
1193472, 意义深刻，但不会讲故事
587545, 小妮妮的骚气，哎哟！！
638924, 段小姐是那么爱玄奘。。
1299105, 还行，能够把故事讲完，
638945, 我去，黄渤易啊刚！！！
1332158, 夏雨演的那个老金太吵了
519973, 初看很好笑，细想很恶心
658378, 觉得周星星老了 好辛苦
518021, 很一般的喜剧，被过誉了
546999, 挺好笑的，剧情一般般吧
1349462, 完全没有看出来是陈坤😅
1299010, 在家看果然特效大打折扣
1356117, 哎，就是期待不能那么高
1356128, 毕竟原著党 没想像中好
592634, 舒淇很好。结尾很糟糕。
586451, 挺有个性特色的一个英雄
647400, 惊悚  喜剧。 凑合。
1356147, 坤哥有没有胡子，都帅。
575835, 片尾彩蛋好美妙啊= =
625406, 如果没有笑笑就给五星。
625408, 我基本上捂着眼睛看完的
658618, 他已经不是当年的周星驰
1276788, 特效水平上了一个台阶啊
1313511, 少有的不错的国产魔幻片
592601, 某一个瞬间我还是感动了
1234185, 什么鬼，是我不够文艺？
1276659, 不晓得那个尊师是搞莫滴
592603, 这绝对算是15X了吧！
639401, 炒旧饭也要认真的点啊！
575800, 还行把 不太喜欢科幻的
517349, 三星半，某些细节很不错
575840, 機器人小呆激萌呀XD~
1297013, 还好，比之前拍的那些好
1356187, 特效很好，但是内容一般
645167, 呃，造型无力吐槽...
1186095, 片尾曲好听 其他的无聊
520516, 原来是：夏洛，特烦恼。
592534, 有看点，可惜结尾像拉稀
1348335, 特效还好。主要看黄渤。
663927, 没看出搞笑boring
1355982, 天王盖地虎，宝塔镇河妖
607252, 娱乐之用，无特别感触。
1317939, imax，主要看特效。
1356008, 主要是特效，剧情一般。
547797, 一般般吧 还算有些笑点
1276567, 没看过原作，觉得还行？
1297257, 比姚大嘴那部好太多……
1192986, 情义果然没有狗的寿命长
639358, 还是有欢笑与泪水并存的
547769, 不是自己喜欢的类型片子
637224, 孙悟空是个什么鬼⊙﹏⊙
1390040, 真像北京奥运会开幕式啊
1304030, 舒淇很性感长得像张小哥
575709, 有点混乱，不是我的菜！
542796, 笑点还行，不敢苟同三观
1394504, 景甜背景真是深····
621460, 笑点很老。。。特效不错
1356049, 并没有预想中的好看……
